18:29:01.719928 IP 172.16.20.179.5353 > 224.0.0.251.5353: 0*- [0q] 1/0/0 PTR 3.21.0.36-MSI.4d60bb13-e55b-41d0-be3d-059b67380cda._nvstream_dbd._tcp.local. (101)
18:29:01.778809 IP 172.16.20.51.54915 > 172.16.23.255.54915: UDP, length 263
18:29:01.799605 ARP, Request who-has 172.16.19.3 tell 172.16.16.62, length 46
18:29:01.799606 ARP, Request who-has 172.16.19.2 tell 172.16.16.62, length 46
18:29:01.799606 ARP, Request who-has 172.16.19.14 tell 172.16.16.62, length 46
18:29:01.799606 ARP, Request who-has 172.16.19.15 tell 172.16.16.62, length 46
18:29:01.800035 ARP, Request who-has 172.16.19.27 tell 172.16.16.62, length 46
18:29:01.800164 ARP, Request who-has 172.16.19.30 tell 172.16.16.62, length 46
18:29:01.801295 ARP, Request who-has 172.16.19.39 (50:22:dd:9f:18:8e) tell 172.16.16.62, length 46
18:29:01.809273 ARP, Request who-has 172.16.19.1 tell 172.16.16.62, length 46
18:29:01.809274 ARP, Request who-has 172.16.19.13 tell 172.16.16.62, length 46
18:29:01.809274 ARP, Request who-has 172.16.19.31 tell 172.16.16.62, length 46
18:29:01.809303 ARP, Request who-has 172.16.19.26 tell 172.16.16.62, length 46
18:29:01.809303 ARP, Request who-has 172.16.19.29 tell 172.16.16.62, length 46
18:29:01.809303 ARP, Request who-has 172.16.19.28 tell 172.16.16.62, length 46
18:29:01.966665 ARP, Request who-has 172.16.19.8 tell 0.0.0.0, length 46
18:29:01.981667 IP 172.16.21.82.64369 > 239.255.255.250.1900: UDP, length 175
18:29:02.085214 ARP, Request who-has 172.16.19.42 tell 0.0.0.0, length 46
18:29:02.088600 IP 192.168.1.194.51816 > 239.255.255.250.1900: UDP, length 137
18:29:02.093166 IP 172.16.19.66.36072 > 239.255.255.250.1900: UDP, length 125
18:29:02.102111 ARP, Request who-has 172.16.19.7 tell 0.0.0.0, length 46
18:29:02.118480 ARP, Request who-has 172.16.16.61 tell 172.16.16.61, length 46
18:29:02.118481 ARP, Unknown (5) 
	0x0000:  0001 0800 0604 0005 fef6 0c30 8eed ac10  ...........0....
	0x0010:  103d 0000 0000 0000 ac10 103d 6154 7a51  .=.........=aTzQ
	0x0020:  0000 0000 0000 0000 0000 0000 0000 0000  ................
	0x0030:  0000 0000 0000 0000 0000 0000 0000 0000  ................
	0x0040:  0000 0000 0000 0000 0000 0000 0000 0000  ................
	0x0050:  0000 0000 0000 0000 0000 0000            ............
18:29:02.132929 ARP, Request who-has 169.254.164.10 tell 0.0.0.0, length 46
18:29:02.142452 IP6 fe80::4f6:d0b9:b469:6b44.51820 > ff02::c.3702: UDP, length 624
18:29:02.192920 ARP, Request who-has 169.254.204.62 tell 0.0.0.0, length 46
18:29:02.212915 IP 172.16.16.43.33897 > 255.255.255.255.7437: UDP, length 173
18:29:02.231519 IP6 fe80::4f6:d0b9:b469:6b44.51814 > ff02::c.1900: UDP, length 95
18:29:02.232348 IP 192.168.1.194.51816 > 239.255.255.250.1900: UDP, length 101
18:29:02.247800 IP 172.16.21.190.51382 > 239.255.255.250.1900: UDP, length 137
18:29:02.250558 ARP, Request who-has 172.16.19.15 tell 0.0.0.0, length 46
18:29:02.262604 ARP, Request who-has 172.16.19.39 tell 0.0.0.0, length 46
18:29:02.268701 IP6 fe80::4f6:d0b9:b469:6b44.51814 > ff02::c.1900: UDP, length 121
18:29:02.268702 IP 192.168.1.194.51816 > 239.255.255.250.1900: UDP, length 127
18:29:02.285750 ARP, Request who-has 172.16.16.42 tell 172.16.22.173, length 46
18:29:02.298309 IP6 fe80::4f6:d0b9:b469:6b44.51814 > ff02::c.1900: UDP, length 121
18:29:02.299043 IP 192.168.1.194.51816 > 239.255.255.250.1900: UDP, length 127
18:29:02.329430 ARP, Request who-has 172.16.19.5 tell 0.0.0.0, length 46
18:29:02.338743 IP6 fe80::4f6:d0b9:b469:6b44.51814 > ff02::c.1900: UDP, length 121
18:29:02.340152 IP 192.168.1.194.51816 > 239.255.255.250.1900: UDP, length 127
18:29:02.369365 IP 192.168.1.194.137 > 192.168.1.255.137: UDP, length 50
18:29:02.370430 IP6 fe80::4f6:d0b9:b469:6b44.51814 > ff02::c.1900: UDP, length 121
18:29:02.370431 IP 192.168.1.194.51816 > 239.255.255.250.1900: UDP, length 127
18:29:02.385240 ARP, Request who-has 172.16.19.43 tell 0.0.0.0, length 46
18:29:02.392038 IP 172.16.19.66.36072 > 239.255.255.250.1900: UDP, length 125
18:29:02.399241 IP6 fe80::4f6:d0b9:b469:6b44.51814 > ff02::c.1900: UDP, length 121
18:29:02.399948 IP 192.168.1.194.51816 > 239.255.255.250.1900: UDP, length 127
18:29:02.433784 IP6 fe80::4f6:d0b9:b469:6b44.51814 > ff02::c.1900: UDP, length 121
18:29:02.434417 IP 192.168.1.194.51816 > 239.255.255.250.1900: UDP, length 127
18:29:02.459624 IP 172.16.20.51.55065 > 224.2.2.2.8995: UDP, length 30
18:29:02.471457 ARP, Request who-has 172.16.18.225 tell 172.16.16.61, length 46
18:29:02.472604 IP 192.168.1.194.51816 > 239.255.255.250.1900: UDP, length 137
18:29:02.487139 ARP, Request who-has 172.16.17.6 tell 172.16.17.6, length 46
18:29:02.519017 ARP, Request who-has 172.16.17.1 tell 172.16.16.60, length 46
18:29:02.519018 ARP, Request who-has 172.16.17.22 tell 172.16.16.60, length 46
18:29:02.519018 ARP, Request who-has 172.16.17.21 tell 172.16.16.60, length 46
18:29:02.519018 ARP, Request who-has 172.16.17.2 tell 172.16.16.60, length 46
18:29:02.519018 ARP, Request who-has 172.16.17.11 tell 172.16.16.60, length 46
18:29:02.519018 ARP, Request who-has 172.16.17.9 tell 172.16.16.60, length 46
18:29:02.524078 IP 172.16.23.6.137 > 172.16.23.255.137: UDP, length 50
18:29:02.672207 IP 172.16.16.45.45088 > 255.255.255.255.7437: UDP, length 173
18:29:02.693268 IP 172.16.19.66.36072 > 239.255.255.250.1900: UDP, length 125
18:29:02.784269 IP 172.16.20.51.54915 > 172.16.23.255.54915: UDP, length 263
18:29:02.790978 IP 142.251.12.188.5228 > 172.16.22.63.61676: Flags [P.], seq 2863094184:2863094208, ack 1676567721, win 265, options [nop,nop,TS val 3244730431 ecr 110792304], length 24
18:29:02.796129 ARP, Request who-has 172.16.19.3 tell 172.16.16.62, length 46
18:29:02.796129 ARP, Request who-has 172.16.19.2 tell 172.16.16.62, length 46
18:29:02.796129 ARP, Request who-has 172.16.19.14 tell 172.16.16.62, length 46
18:29:02.796129 ARP, Request who-has 172.16.19.15 tell 172.16.16.62, length 46
18:29:02.796129 ARP, Request who-has 172.16.19.27 tell 172.16.16.62, length 46
18:29:02.796129 ARP, Request who-has 172.16.19.30 tell 172.16.16.62, length 46
18:29:02.803752 ARP, Request who-has 172.16.16.1 tell 172.16.20.32, length 46
18:29:02.851551 IP 172.16.16.61.34002 > 239.255.255.250.1900: UDP, length 137
18:29:02.873525 IP6 fe80::9ada:c4ff:fed5:9bb4 > ff02::1: HBH ICMP6, multicast listener query v2 [gaddr ::], length 28
18:29:02.891526 IP6 fe80::c107:a66f:46f2:a17 > ff02::16: HBH ICMP6, multicast listener report v2, 2 group record(s), length 48
18:29:02.905402 IP 192.168.1.194.5353 > 224.0.0.251.5353: 0 PTR (QM)? _googlecast._tcp.local. (40)
18:29:02.905521 IP6 fe80::4f6:d0b9:b469:6b44.5353 > ff02::fb.5353: 0 PTR (QM)? _googlecast._tcp.local. (40)
18:29:02.905548 IP 192.168.1.194.5353 > 224.0.0.251.5353: 0 PTR (QM)? _googlecast._tcp.local. (40)
18:29:02.905667 IP6 fe80::4f6:d0b9:b469:6b44.5353 > ff02::fb.5353: 0 PTR (QM)? _googlecast._tcp.local. (40)
18:29:02.918100 IP6 fe80::d91b:8e47:3eed:8a7e > ff02::16: HBH ICMP6, multicast listener report v2, 1 group record(s), length 28
18:29:02.932052 IP6 fe80::895a:635e:4ef6:329 > ff02::16: HBH ICMP6, multicast listener report v2, 2 group record(s), length 48
18:29:02.935958 IP6 fe80::78d5:dfd:a51f:c96b > ff02::16: HBH ICMP6, multicast listener report v2, 1 group record(s), length 28
18:29:02.936232 IP6 fe80::7038:40c7:b3bb:12c4 > ff02::16: HBH ICMP6, multicast listener report v2, 1 group record(s), length 28
18:29:02.962674 IP6 fe80::fc77:43c8:34a0:c142 > ff02::16: HBH ICMP6, multicast listener report v2, 1 group record(s), length 28
18:29:02.981928 IP 172.16.21.82.64369 > 239.255.255.250.1900: UDP, length 175
18:29:02.986789 IP6 fe80::8c1c:a239:a32b:5f03 > ff02::16: HBH ICMP6, multicast listener report v2, 1 group record(s), length 28
18:29:03.003251 IP 192.168.1.194.5353 > 224.0.0.251.5353: 0*- [0q] 8/0/5 (Cache flush) TXT "", PTR _ni-logos._tcp.local., PTR DESKTOP-P8N54AU._ni-logos._tcp.local., (Cache flush) SRV DESKTOP-P8N54AU.local.:2343 0 0, (Cache flush) PTR DESKTOP-P8N54AU.local., (Cache flush) PTR DESKTOP-P8N54AU.local., (Cache flush) A 192.168.1.194, (Cache flush) AAAA fe80::4f6:d0b9:b469:6b44 (414)
18:29:03.012377 IP6 fe80::1570:a194:cbcd:832a > ff02::16: HBH ICMP6, multicast listener report v2, 1 group record(s), length 28
18:29:03.018379 IP 192.168.1.194.51819 > 239.255.255.250.3702: UDP, length 624
18:29:03.027663 IP6 fe80::3185:8d64:ffcc:f7a6 > ff02::16: HBH ICMP6, multicast listener report v2, 1 group record(s), length 28
18:29:03.028915 IP 172.16.16.60.55505 > 255.255.255.255.51819: UDP, bad length 2085 > 1472
18:29:03.028916 IP 172.16.16.60 > 255.255.255.255: ip-proto-17
18:29:03.032693 IP 172.16.16.62.59302 > 255.255.255.255.51819: UDP, bad length 2071 > 1472
18:29:03.032693 IP 172.16.16.62 > 255.255.255.255: ip-proto-17
18:29:03.039309 IP6 fe80::254d:6a48:d986:d9b1 > ff02::16: HBH ICMP6, multicast listener report v2, 1 group record(s), length 28
18:29:03.047920 IP6 fe80::5588:c224:7cb4:fe04 > ff02::16: HBH ICMP6, multicast listener report v2, 1 group record(s), length 28
18:29:03.054054 IP 172.16.16.44.50767 > 255.255.255.255.7437: UDP, length 173
18:29:03.060118 IP6 fe80::7443:84ff:fefc:685c > ff02::2: ICMP6, router solicitation, length 16
18:29:03.060118 IP6 fe80::b978:1225:6766:942 > ff02::16: HBH ICMP6, multicast listener report v2, 1 group record(s), length 28
18:29:03.064952 IP6 fe80::f4c2:fa8a:2e3a:a9be > ff02::16: HBH ICMP6, multicast listener report v2, 1 group record(s), length 28
18:29:03.068216 IP 172.16.20.14.58094 > 255.255.255.255.3956: UDP, length 8
18:29:03.082660 IP6 fe80::d408:dba5:4cbb:5033 > ff02::16: HBH ICMP6, multicast listener report v2, 2 group record(s), length 48
18:29:03.089003 IP6 fe80::c581:8ff4:db26:d27a > ff02::16: HBH ICMP6, multicast listener report v2, 1 group record(s), length 28
18:29:03.089645 IP6 fe80::600f:5303:a718:3633 > ff02::16: HBH ICMP6, multicast listener report v2, 1 group record(s), length 28
18:29:03.095970 IP6 fe80::44c6:d30:dd06:6092 > ff02::16: HBH ICMP6, multicast listener report v2, 1 group record(s), length 28
18:29:03.106425 ARP, Unknown (5) 
	0x0000:  0001 0800 0604 0005 fef6 0c30 8eed ac10  ...........0....
	0x0010:  103d 0000 0000 0000 ac10 103d 6154 7a51  .=.........=aTzQ
	0x0020:  0000 0000 0000 0000 0000 0000 0000 0000  ................
	0x0030:  0000 0000 0000 0000 0000 0000 0000 0000  ................
	0x0040:  0000 0000 0000 0000 0000 0000 0000 0000  ................
	0x0050:  0000 0000 0000 0000 0000 0000            ............
18:29:03.115468 IP6 fe80::d408:dba5:4cbb:5033.546 > ff02::1:2.547: dhcp6 solicit
18:29:03.116693 IP6 fe80::b481:2991:28e3:909d > ff02::16: HBH ICMP6, multicast listener report v2, 1 group record(s), length 28
18:29:03.133826 IP6 fe80::e85e:a271:a5a9:2d09 > ff02::16: HBH ICMP6, multicast listener report v2, 1 group record(s), length 28
18:29:03.173558 ARP, Request who-has 172.16.19.4 tell 0.0.0.0, length 46
18:29:03.176244 IP 172.16.21.187.58278 > 239.255.255.250.1900: UDP, length 175
18:29:03.205418 IP6 fe80::5452:422f:214d:6a20 > ff02::16: HBH ICMP6, multicast listener report v2, 2 group record(s), length 48
18:29:03.214609 IP6 fe80::2c0a:4b3a:180e:d317 > ff02::16: HBH ICMP6, multicast listener report v2, 2 group record(s), length 48
18:29:03.239900 IP6 fe80::3db4:de3c:3d48:6c23 > ff02::16: HBH ICMP6, multicast listener report v2, 1 group record(s), length 28
18:29:03.241388 ARP, Request who-has 172.16.19.13 tell 0.0.0.0, length 46
18:29:03.242720 IP6 fe80::e8b4:ba40:af25:41b8 > ff02::16: HBH ICMP6, multicast listener report v2, 1 group record(s), length 28
18:29:03.250646 IP6 fe80::78a9:c2b9:8a3c:9afa > ff02::16: HBH ICMP6, multicast listener report v2, 2 group record(s), length 48
18:29:03.251935 IP6 fe80::9559:a30b:c814:7c2d > ff02::16: HBH ICMP6, multicast listener report v2, 2 group record(s), length 48
18:29:03.253266 IP6 fe80::4f6:d0b9:b469:6b44 > ff02::16: HBH ICMP6, multicast listener report v2, 1 group record(s), length 28
18:29:03.259974 IP6 fe80::4c8a:ce3d:1fe4:940d > ff02::16: HBH ICMP6, multicast listener report v2, 1 group record(s), length 28
18:29:03.260687 IP 172.16.23.6.137 > 172.16.23.255.137: UDP, length 50
18:29:03.281655 IP6 fe80::81fe:2c28:4e99:a038 > ff02::16: HBH ICMP6, multicast listener report v2, 1 group record(s), length 28
18:29:03.284759 ARP, Request who-has 172.16.16.42 tell 172.16.22.173, length 46
18:29:03.292112 IP6 fe80::9c8:6b5c:c14d:66b9 > ff02::16: HBH ICMP6, multicast listener report v2, 1 group record(s), length 28
18:29:03.292112 IP6 :: > ff02::16: HBH ICMP6, multicast listener report v2, 2 group record(s), length 48
18:29:03.299417 IP6 fe80::24ca:623e:4422:b36a > ff02::16: HBH ICMP6, multicast listener report v2, 2 group record(s), length 48
18:29:03.345657 IP6 fe80::45ea:448b:1d60:5a6c > ff02::16: HBH ICMP6, multicast listener report v2, 1 group record(s), length 28
18:29:03.357518 IP6 fe80::58d6:1ec3:432d:37cb > ff02::16: HBH ICMP6, multicast listener report v2, 1 group record(s), length 28
18:29:03.362559 IP 172.16.20.14.55341 > 255.255.255.255.3956: UDP, length 8
18:29:03.362868 IP 172.16.20.14.58855 > 255.255.255.255.3956: UDP, length 8
18:29:03.375825 IP6 fe80::88a2:5451:b35:8b9c > ff02::16: HBH ICMP6, multicast listener report v2, 1 group record(s), length 28
18:29:03.388619 IP6 fe80::4996:6b00:d798:9eb9 > ff02::16: HBH ICMP6, multicast listener report v2, 1 group record(s), length 28
18:29:03.417353 IP6 fe80::d84d:4aba:3bb9:d64b > ff02::16: HBH ICMP6, multicast listener report v2, 1 group record(s), length 28
18:29:03.437398 IP6 fe80::f0b2:69ff:fe78:9c38 > ff02::16: HBH ICMP6, multicast listener report v2, 1 group record(s), length 28
18:29:03.452454 IP6 fe80::7038:40c7:b3bb:12c4 > ff02::16: HBH ICMP6, multicast listener report v2, 1 group record(s), length 28
18:29:03.466449 IP6 fe80::20ec:cdcf:5acc:2262 > ff02::16: HBH ICMP6, multicast listener report v2, 1 group record(s), length 28
18:29:03.471579 ARP, Request who-has 172.16.18.225 tell 172.16.16.61, length 46
18:29:03.482196 IP6 fe80::8dc1:3c6f:68fc:6c7a > ff02::16: HBH ICMP6, multicast listener report v2, 2 group record(s), length 48
18:29:03.485933 IP 172.16.20.51.55065 > 224.2.2.2.8995: UDP, length 30
18:29:03.518054 ARP, Request who-has 172.16.17.1 tell 172.16.16.60, length 46
18:29:03.518055 ARP, Request who-has 172.16.17.22 tell 172.16.16.60, length 46
18:29:03.518055 ARP, Request who-has 172.16.17.2 tell 172.16.16.60, length 46
18:29:03.518077 ARP, Request who-has 172.16.17.21 tell 172.16.16.60, length 46
18:29:03.518077 ARP, Request who-has 172.16.17.9 tell 172.16.16.60, length 46
18:29:03.518077 ARP, Request who-has 172.16.17.11 tell 172.16.16.60, length 46
18:29:03.524540 ARP, Request who-has 172.16.17.12 tell 172.16.16.60, length 46
18:29:03.524540 ARP, Request who-has 172.16.17.10 tell 172.16.16.60, length 46
18:29:03.524540 ARP, Request who-has 172.16.17.13 tell 172.16.16.60, length 46
18:29:03.524540 ARP, Request who-has 172.16.17.4 tell 172.16.16.60, length 46
18:29:03.524540 ARP, Request who-has 172.16.17.15 tell 172.16.16.60, length 46
18:29:03.524648 ARP, Request who-has 172.16.17.19 tell 172.16.16.60, length 46
18:29:03.539095 IP6 fe80::254d:6a48:d986:d9b1 > ff02::16: HBH ICMP6, multicast listener report v2, 2 group record(s), length 48
18:29:03.560111 IP6 fe80::d084:7c1a:10d8:e0c1 > ff02::16: HBH ICMP6, multicast listener report v2, 1 group record(s), length 28
18:29:03.565142 IP6 fe80::e870:4250:e2e0:2a41 > ff02::16: HBH ICMP6, multicast listener report v2, 1 group record(s), length 28
18:29:03.576103 ARP, Request who-has 169.254.144.71 tell 0.0.0.0, length 46
18:29:03.604174 IP6 fe80::600f:5303:a718:3633 > ff02::16: HBH ICMP6, multicast listener report v2, 1 group record(s), length 28
18:29:03.629558 IP6 fe80::8ce6:682f:b377:a86a > ff02::16: HBH ICMP6, multicast listener report v2, 2 group record(s), length 48
18:29:03.653657 ARP, Request who-has 172.16.17.20 tell 172.16.17.20, length 46
18:29:03.654628 IP 192.168.1.1.45690 > 255.255.255.255.7437: UDP, length 173
18:29:03.674675 ARP, Request who-has 172.16.16.1 tell 172.16.20.32, length 46
18:29:03.687186 IP6 fe80::d588:dd0:6de5:b3 > ff02::16: HBH ICMP6, multicast listener report v2, 1 group record(s), length 28
18:29:03.694599 IP6 fe80::9c0b:c45f:8f49:a27b > ff02::16: HBH ICMP6, multicast listener report v2, 1 group record(s), length 28
18:29:03.721647 IP6 fe80::da32:e3ff:fe50:f162 > ff02::16: HBH ICMP6, multicast listener report v2, 2 group record(s), length 48
18:29:03.729269 ARP, Request who-has 172.16.19.1 tell 0.0.0.0, length 46
18:29:03.748403 IP6 fe80::4c8a:ce3d:1fe4:940d > ff02::16: HBH ICMP6, multicast listener report v2, 1 group record(s), length 28
18:29:03.751889 IP6 fe80::ec24:311e:f47:4736 > ff02::16: HBH ICMP6, multicast listener report v2, 1 group record(s), length 28
18:29:03.751890 IP6 fe80::3db4:de3c:3d48:6c23 > ff02::16: HBH ICMP6, multicast listener report v2, 1 group record(s), length 28
18:29:03.766982 IP6 fe80::e450:6605:4185:292c > ff02::16: HBH ICMP6, multicast listener report v2, 1 group record(s), length 28
18:29:03.776117 IP 172.16.20.51.54915 > 172.16.23.255.54915: UDP, length 263
18:29:03.781400 IP6 fe80::51c5:152a:66af:872c > ff02::16: HBH ICMP6, multicast listener report v2, 1 group record(s), length 28
18:29:03.798349 ARP, Request who-has 172.16.19.3 tell 172.16.16.62, length 46
18:29:03.798350 ARP, Request who-has 172.16.19.2 tell 172.16.16.62, length 46
18:29:03.798350 ARP, Request who-has 172.16.19.15 tell 172.16.16.62, length 46
18:29:03.798350 ARP, Request who-has 172.16.19.14 tell 172.16.16.62, length 46
18:29:03.798350 ARP, Request who-has 172.16.19.27 tell 172.16.16.62, length 46
18:29:03.798350 ARP, Request who-has 172.16.19.30 tell 172.16.16.62, length 46
18:29:03.851369 IP6 fe80::1496:ef6c:4640:935a > ff02::16: HBH ICMP6, multicast listener report v2, 1 group record(s), length 28
18:29:03.878424 IP6 fe80::6448:49fc:25b:fc78 > ff02::16: HBH ICMP6, multicast listener report v2, 1 group record(s), length 28
18:29:03.891304 IP6 fe80::8c40:3f90:e784:6aa7 > ff02::16: HBH ICMP6, multicast listener report v2, 1 group record(s), length 28
18:29:03.979117 IP6 fe80::2d67:e177:bb12:a84d > ff02::16: HBH ICMP6, multicast listener report v2, 1 group record(s), length 28
18:29:03.982396 IP6 fe80::25f9:cdc3:1476:de40 > ff02::16: HBH ICMP6, multicast listener report v2, 1 group record(s), length 28
18:29:03.997655 IP 172.16.21.82.64369 > 239.255.255.250.1900: UDP, length 175
18:29:04.027649 IP 172.16.23.6.137 > 172.16.23.255.137: UDP, length 50
18:29:04.039731 ARP, Request who-has 172.16.17.3 tell 172.16.17.3, length 46
18:29:04.046623 IP6 fe80::500b:74ff:fe0f:8687 > ff02::16: HBH ICMP6, multicast listener report v2, 4 group record(s), length 88
18:29:04.049445 IP6 fe80::a9bf:d90b:b15e:cef4 > ff02::16: HBH ICMP6, multicast listener report v2, 1 group record(s), length 28
18:29:04.071533 IP6 fe80::793b:26fb:3e6c:f7d0 > ff02::16: HBH ICMP6, multicast listener report v2, 1 group record(s), length 28
18:29:04.085754 IP6 fe80::3dd0:2628:8b28:d13a > ff02::16: HBH ICMP6, multicast listener report v2, 1 group record(s), length 28
18:29:04.115528 IP6 fe80::6a6d:bcff:fee8:f57f > ff02::16: HBH ICMP6, multicast listener report v2, 1 group record(s), length 28
18:29:04.116509 ARP, Request who-has 172.16.19.40 tell 0.0.0.0, length 46
18:29:04.121200 ARP, Unknown (5) 
	0x0000:  0001 0800 0604 0005 fef6 0c30 8eed ac10  ...........0....
	0x0010:  103d 0000 0000 0000 ac10 103d 6154 7a51  .=.........=aTzQ
	0x0020:  0000 0000 0000 0000 0000 0000 0000 0000  ................
	0x0030:  0000 0000 0000 0000 0000 0000 0000 0000  ................
	0x0040:  0000 0000 0000 0000 0000 0000 0000 0000  ................
	0x0050:  0000 0000 0000 0000 0000 0000            ............
18:29:04.134415 IP 172.16.22.141.33346 > 142.250.67.46.443: Flags [P.], seq 3573602176:3573602200, ack 236355515, win 364, options [nop,nop,TS val 3106154845 ecr 3443321389], length 24
18:29:04.135028 IP 172.16.22.141.33346 > 142.250.67.46.443: Flags [F.], seq 24, ack 1, win 364, options [nop,nop,TS val 3106154846 ecr 3443321389], length 0
18:29:04.146690 IP6 fe80::916a:caee:b374:38e7 > ff02::16: HBH ICMP6, multicast listener report v2, 1 group record(s), length 28
18:29:04.151907 IP6 fe80::385b:ee1f:1e75:240e > ff02::16: HBH ICMP6, multicast listener report v2, 1 group record(s), length 28
18:29:04.165903 IP 142.251.12.188.5228 > 172.16.22.63.61676: Flags [P.], seq 0:24, ack 1, win 265, options [nop,nop,TS val 3244731802 ecr 110792304], length 24
18:29:04.171202 IP 142.250.67.46.443 > 172.16.22.141.33346: Flags [R], seq 236355515, win 0, length 0
18:29:04.174623 ARP, Request who-has 172.16.19.179 tell 172.16.19.70, length 46
18:29:04.193744 IP 172.16.21.187.58278 > 239.255.255.250.1900: UDP, length 175
18:29:04.203328 IP 172.16.22.34.57298 > 239.255.255.250.1900: UDP, length 175
18:29:04.243655 IP6 fe80::e8b4:ba40:af25:41b8 > ff02::16: HBH ICMP6, multicast listener report v2, 1 group record(s), length 28
18:29:04.264524 IP6 fe80::9c8:6b5c:c14d:66b9.546 > ff02::1:2.547: dhcp6 solicit
18:29:04.288138 IP6 fe80::fdb3:9545:64fc:e722 > ff02::16: HBH ICMP6, multicast listener report v2, 2 group record(s), length 48
18:29:04.308646 IP6 fe80::e6f1:4cff:fe10:981 > ff02::16: HBH ICMP6, multicast listener report v2, 1 group record(s), length 28
18:29:04.319976 IP6 :: > ff02::16: HBH ICMP6, multicast listener report v2, 2 group record(s), length 48
18:29:04.399371 IP6 fe80::55a9:9e56:21c9:c537 > ff02::16: HBH ICMP6, multicast listener report v2, 2 group record(s), length 48
18:29:04.417245 IP6 fe80::d84d:4aba:3bb9:d64b > ff02::16: HBH ICMP6, multicast listener report v2, 1 group record(s), length 28
18:29:04.424532 IP6 fe80::f417:f692:21ae:e91d > ff02::16: HBH ICMP6, multicast listener report v2, 1 group record(s), length 28
18:29:04.448439 IP6 fe80::895a:635e:4ef6:329 > ff02::16: HBH ICMP6, multicast listener report v2, 1 group record(s), length 28
18:29:04.458674 IP 172.16.20.51.55065 > 224.2.2.2.8995: UDP, length 30
18:29:04.466096 ARP, Request who-has 169.254.215.12 tell 0.0.0.0, length 46
18:29:04.471199 IP6 fe80::8dc1:3c6f:68fc:6c7a > ff02::16: HBH ICMP6, multicast listener report v2, 1 group record(s), length 28
18:29:04.475300 IP6 fe80::2d67:e177:bb12:a84d > ff02::16: HBH ICMP6, multicast listener report v2, 1 group record(s), length 28
18:29:04.519519 ARP, Request who-has 172.16.17.13 tell 172.16.16.60, length 46
18:29:04.519519 ARP, Request who-has 172.16.17.10 tell 172.16.16.60, length 46
18:29:04.519519 ARP, Request who-has 172.16.17.15 tell 172.16.16.60, length 46
18:29:04.519519 ARP, Request who-has 172.16.17.12 tell 172.16.16.60, length 46
18:29:04.519520 ARP, Request who-has 172.16.17.19 tell 172.16.16.60, length 46
18:29:04.519520 ARP, Request who-has 172.16.17.11 tell 172.16.16.60, length 46
18:29:04.519520 ARP, Request who-has 172.16.17.4 tell 172.16.16.60, length 46
18:29:04.527096 IP6 fe80::28ba:859:a471:449f > ff02::16: HBH ICMP6, multicast listener report v2, 1 group record(s), length 28
18:29:04.534185 IP6 fe80::5170:c21c:636c:2bda > ff02::16: HBH ICMP6, multicast listener report v2, 1 group record(s), length 28
18:29:04.538572 IP6 fe80::3185:8d64:ffcc:f7a6 > ff02::16: HBH ICMP6, multicast listener report v2, 1 group record(s), length 28
18:29:04.549443 IP6 fe80::5588:c224:7cb4:fe04 > ff02::16: HBH ICMP6, multicast listener report v2, 1 group record(s), length 28
18:29:04.573415 IP6 fe80::c9d6:e1ba:c24d:fdaf > ff02::16: HBH ICMP6, multicast listener report v2, 1 group record(s), length 28
18:29:04.591648 ARP, Request who-has 172.16.18.209 tell 172.16.16.61, length 46
18:29:04.616320 ARP, Request who-has 172.16.19.37 tell 0.0.0.0, length 46
18:29:04.624365 64:db:8b:a4:60:e1 > ff:ff:ff:ff:ff:ff, ethertype Unknown (0x8033), length 416: 
	0x0000:  2101 01f6 0000 0000 0604 0400 527c 64db  !...........R|d.
	0x0010:  8ba4 60e1 ac10 103f ffff ffff ffff 0000  ..`....?........
	0x0020:  0000 ffff f800 4453 2d37 4130 3848 4748  ......DS-7A08HGH
	0x0030:  492d 4631 5c45 434f 3038 3230 3138 3034  I-F1\ECO08201804
	0x0040:  3132 4343 5752 4331 3538 3337 3336 3157  12CCWRC15837361W
	0x0050:  4356 5500 0000 0000 a807 0000 1f40 0000  CVU..........@..
	0x0060:  0008 0000 0000 5633 2e34 2e38 3862 7569  ......V3.4.88bui
	0x0070:  6c64 2031 3830 3133 3100 0000 0000 0000  ld.180131.......
	0x0080:  0000 0000 0000 0000 0000 0000 0000 0000  ................
	0x0090:  0000 0000 0000 5635 2e30 2c20 6275 696c  ......V5.0,.buil
	0x00a0:  6420 3138 3031 3236 0000 0000 0000 0000  d.180126........
	0x00b0:  0000 0000 0000 0000 0000 0000 0000 0000  ................
	0x00c0:  0000 0000 0000 3230 3232 2d30 382d 3033  ......2022-08-03
	0x00d0:  2031 353a 3234 3a32 3900 0000 0000 0000  .15:24:29.......
	0x00e0:  0000 0000 0000 0000 0000 0000 0000 0000  ................
	0x00f0:  0000 0000 0000 029c ddbe ac10 1001 fe80  ................
	0x0100:  0000 0000 0000 66db 8bff fea4 60e1 0000  ......f.....`...
	0x0110:  0000 0000 0000 0000 0000 0000 0000 40c5  ..............@.
	0x0120:  000f 0000 0000 0000 0000 0000 0000 0000  ................
	0x0130:  0000 0000 0000 0000 0000 0000 0000 0050  ...............P
	0x0140:  0000 0000 0000 0000 0000 0000 0000 0000  ................
	0x0150:  0000 0000 0000 0000 0000 0000 0000 0000  ................
	0x0160:  0000 4453 2d37 4130 3848 4748 492d 4631  ..DS-7A08HGHI-F1
	0x0170:  5c45 434f 0000 0000 0000 4e2f 4100 0000  \ECO......N/A...
	0x0180:  0000 0000 0000 0000 0000 0000 0000 0000  ................
	0x0190:  0000                                     ..
18:29:04.629319 68:6d:bc:e8:f5:7f > ff:ff:ff:ff:ff:ff, ethertype Unknown (0x8033), length 416: 
	0x0000:  2101 01f6 0000 0000 0604 0400 c88e 686d  !.............hm
	0x0010:  bce8 f57f ac10 100c ffff ffff ffff 0000  ................
	0x0020:  0000 ffff f800 4453 2d37 4130 3448 4748  ......DS-7A04HGH
	0x0030:  492d 4631 5c45 434f 3034 3230 3139 3038  I-F1\ECO04201908
	0x0040:  3130 4141 5752 4434 3937 3936 3734 3657  10AAWRD49796746W
	0x0050:  4356 5500 0000 0000 a443 0000 1f40 0000  CVU......C...@..
	0x0060:  0004 0000 0000 5633 2e34 2e38 3931 6275  ......V3.4.891bu
	0x0070:  696c 6420 3139 3031 3231 0000 0000 0000  ild.190121......
	0x0080:  0000 0000 0000 0000 0000 0000 0000 0000  ................
	0x0090:  0000 0000 0000 5635 2e30 2c20 6275 696c  ......V5.0,.buil
	0x00a0:  6420 3139 3031 3139 0000 0000 0000 0000  d.190119........
	0x00b0:  0000 0000 0000 0000 0000 0000 0000 0000  ................
	0x00c0:  0000 0000 0000 3139 3730 2d30 312d 3031  ......1970-01-01
	0x00d0:  2030 333a 3034 3a34 3300 0000 0000 0000  .03:04:43.......
	0x00e0:  0000 0000 0000 0000 0000 0000 0000 0000  ................
	0x00f0:  0000 0000 0000 029c 63f9 ac10 1001 fe80  ........c.......
	0x0100:  0000 0000 0000 6a6d bcff fee8 f57f 0000  ......jm........
	0x0110:  0000 0000 0000 0000 0000 0000 0000 40c5  ..............@.
	0x0120:  000f 0000 0000 0000 0000 0000 0000 0000  ................
	0x0130:  0000 0000 0000 0000 0000 0000 0000 0050  ...............P
	0x0140:  0005 0000 0000 0000 0000 0000 0000 0000  ................
	0x0150:  0000 0000 0000 0000 0000 0000 0000 0000  ................
	0x0160:  0000 4453 2d37 4130 3448 4748 492d 4631  ..DS-7A04HGHI-F1
	0x0170:  5c45 434f 0000 0000 0000 4e2f 4100 0000  \ECO......N/A...
	0x0180:  0000 0000 0000 0000 0000 0000 0000 0000  ................
	0x0190:  0000                                     ..
18:29:04.630004 IP 172.16.16.60 > 239.255.255.251: igmp v2 report 239.255.255.251
18:29:04.630309 00:12:41:50:ae:cc > ff:ff:ff:ff:ff:ff, ethertype Unknown (0x8033), length 416: 
	0x0000:  2101 01f6 0000 0000 0604 0400 8d81 0012  !...............
	0x0010:  4150 aecc c0a8 010a ffff ffff ffff 0000  AP..............
	0x0020:  0000 ffff ff00 4453 2d32 4344 3354 3230  ......DS-2CD3T20
	0x0030:  442d 4933 3132 3463 6464 6633 3061 3864  D-I3124cddf30a8d
	0x0040:  3836 3738 0000 0000 0000 0000 0000 0000  8678............
	0x0050:  0000 0000 0000 0002 200f 0000 1f40 0000  .............@..
	0x0060:  0000 0000 0000 5635 2e34 2e30 6275 696c  ......V5.4.0buil
	0x0070:  6420 3136 3036 3031 0000 0000 0000 0000  d.160601........
	0x0080:  0000 0000 0000 0000 0000 0000 0000 0000  ................
	0x0090:  0000 0000 0000 5637 2e33 2062 7569 6c64  ......V7.3.build
	0x00a0:  2031 3630 3731 3300 0000 0000 0000 0000  .160713.........
	0x00b0:  0000 0000 0000 0000 0000 0000 0000 0000  ................
	0x00c0:  0000 0000 0000 3230 3232 2d30 382d 3237  ......2022-08-27
	0x00d0:  2031 323a 3537 3a33 3800 0000 0000 0000  .12:57:38.......
	0x00e0:  0000 0000 0000 0000 0000 0000 0000 0000  ................
	0x00f0:  0000 0000 0000 029c 89db c0a8 0101 0000  ................
	0x0100:  0000 0000 0000 0000 0000 0000 0000 0000  ................
	0x0110:  0000 0000 0000 0000 0000 0000 0000 004f  ...............O
	0x0120:  0000 0000 0000 0000 0000 0000 0000 0000  ................
	0x0130:  0000 0000 0000 0000 0000 0000 0000 0050  ...............P
	0x0140:  0000 0000 0000 0000 0000 4453 2d32 4344  ..........DS-2CD
	0x0150:  5654 2d43 4d4d 2d53 0000 0000 0000 0000  VT-CMM-S........
	0x0160:  0000 4453 2d32 4344 3354 3230 442d 4933  ..DS-2CD3T20D-I3
	0x0170:  0000 0000 0000 0000 0000 0000 0000 0000  ................
	0x0180:  0000 0000 0000 0000 0000 0000 0000 0000  ................
	0x0190:  0000                                     ..
18:29:04.633358 00:12:41:50:ad:ad > ff:ff:ff:ff:ff:ff, ethertype Unknown (0x8033), length 416: 
	0x0000:  2101 01f6 0000 0000 0604 0400 cd91 0012  !...............
	0x0010:  4150 adad ac10 1105 ffff ffff ffff 0000  AP..............
	0x0020:  0000 ffff fc00 4453 2d32 4344 3354 3230  ......DS-2CD3T20
	0x0030:  442d 4933 6439 3636 3434 3638 3339 3130  D-I3d96644683910
	0x0040:  6462 3237 0000 0000 0000 0000 0000 0000  db27............
	0x0050:  0000 0000 0000 0002 200f 0000 1f40 0000  .............@..
	0x0060:  0000 0000 0000 5635 2e34 2e30 6275 696c  ......V5.4.0buil
	0x0070:  6420 3136 3036 3031 0000 0000 0000 0000  d.160601........
	0x0080:  0000 0000 0000 0000 0000 0000 0000 0000  ................
	0x0090:  0000 0000 0000 5637 2e33 2062 7569 6c64  ......V7.3.build
	0x00a0:  2031 3630 3731 3300 0000 0000 0000 0000  .160713.........
	0x00b0:  0000 0000 0000 0000 0000 0000 0000 0000  ................
	0x00c0:  0000 0000 0000 3230 3232 2d30 382d 3234  ......2022-08-24
	0x00d0:  2030 393a 3439 3a33 3300 0000 0000 0000  .09:49:33.......
	0x00e0:  0000 0000 0000 0000 0000 0000 0000 0000  ................
	0x00f0:  0000 0000 0000 029c 89db ac10 1001 0000  ................
	0x0100:  0000 0000 0000 0000 0000 0000 0000 0000  ................
	0x0110:  0000 0000 0000 0000 0000 0000 0000 004f  ...............O
	0x0120:  0000 0000 0000 0000 0000 0000 0000 0000  ................
	0x0130:  0000 0000 0000 0000 0000 0000 0000 0050  ...............P
	0x0140:  0000 0000 0000 0000 0000 4453 2d32 4344  ..........DS-2CD
	0x0150:  5654 2d43 4d4d 2d53 0000 0000 0000 0000  VT-CMM-S........
	0x0160:  0000 4453 2d32 4344 3354 3230 442d 4933  ..DS-2CD3T20D-I3
	0x0170:  0000 0000 0000 0000 0000 0000 0000 0000  ................
	0x0180:  0000 0000 0000 0000 0000 0000 0000 0000  ................
	0x0190:  0000                                     ..
18:29:04.641902 IP 172.16.22.141.54358 > 34.120.52.64.443: Flags [P.], seq 1544652208:1544652299, ack 138515979, win 501, options [nop,nop,TS val 1593426430 ecr 340155071], length 91
18:29:04.641931 IP 172.16.22.141.54358 > 34.120.52.64.443: Flags [P.], seq 91:198, ack 1, win 501, options [nop,nop,TS val 1593426430 ecr 340155071], length 107
18:29:04.646135 00:12:41:50:b1:11 > ff:ff:ff:ff:ff:ff, ethertype Unknown (0x8033), length 416: 
	0x0000:  2101 01f6 0000 0000 0604 0400 f160 0012  !............`..
	0x0010:  4150 b111 ac10 1103 ffff ffff ffff 0000  AP..............
	0x0020:  0000 ffff fc00 4453 2d32 4344 3354 3230  ......DS-2CD3T20
	0x0030:  442d 4933 3166 6634 6664 6235 3462 3331  D-I31ff4fdb54b31
	0x0040:  3535 3964 0000 0000 0000 0000 0000 0000  559d............
	0x0050:  0000 0000 0000 0002 200f 0000 1f40 0000  .............@..
	0x0060:  0000 0000 0000 5635 2e34 2e30 6275 696c  ......V5.4.0buil
	0x0070:  6420 3136 3036 3031 0000 0000 0000 0000  d.160601........
	0x0080:  0000 0000 0000 0000 0000 0000 0000 0000  ................
	0x0090:  0000 0000 0000 5637 2e33 2062 7569 6c64  ......V7.3.build
	0x00a0:  2031 3630 3731 3300 0000 0000 0000 0000  .160713.........
	0x00b0:  0000 0000 0000 0000 0000 0000 0000 0000  ................
	0x00c0:  0000 0000 0000 3230 3232 2d30 382d 3234  ......2022-08-24
	0x00d0:  2031 333a 3331 3a32 3100 0000 0000 0000  .13:31:21.......
	0x00e0:  0000 0000 0000 0000 0000 0000 0000 0000  ................
	0x00f0:  0000 0000 0000 029c 89db ac10 1001 0000  ................
	0x0100:  0000 0000 0000 0000 0000 0000 0000 0000  ................
	0x0110:  0000 0000 0000 0000 0000 0000 0000 004f  ...............O
	0x0120:  0000 0000 0000 0000 0000 0000 0000 0000  ................
	0x0130:  0000 0000 0000 0000 0000 0000 0000 0050  ...............P
	0x0140:  0000 0000 0000 0000 0000 4453 2d32 4344  ..........DS-2CD
	0x0150:  5654 2d43 4d4d 2d53 0000 0000 0000 0000  VT-CMM-S........
	0x0160:  0000 4453 2d32 4344 3354 3230 442d 4933  ..DS-2CD3T20D-I3
	0x0170:  0000 0000 0000 0000 0000 0000 0000 0000  ................
	0x0180:  0000 0000 0000 0000 0000 0000 0000 0000  ................
	0x0190:  0000                                     ..
18:29:04.658916 IP 172.16.23.3.58439 > 239.255.255.250.1900: UDP, length 125
18:29:04.671516 IP6 fe80::88:60ff:fe97:3203 > ff02::16: HBH ICMP6, multicast listener report v2, 2 group record(s), length 48
18:29:04.672327 IP 34.120.52.64.443 > 172.16.22.141.54358: Flags [.], ack 91, win 754, options [nop,nop,TS val 340174654 ecr 1593426430], length 0
18:29:04.672328 IP 34.120.52.64.443 > 172.16.22.141.54358: Flags [.], ack 198, win 754, options [nop,nop,TS val 340174654 ecr 1593426430], length 0
18:29:04.673634 IP 34.120.52.64.443 > 172.16.22.141.54358: Flags [P.], seq 1:40, ack 198, win 754, options [nop,nop,TS val 340174654 ecr 1593426430], length 39
18:29:04.675075 ARP, Request who-has 172.16.16.1 tell 172.16.20.32, length 46
18:29:04.675273 IP6 fe80::a026:fc0:d0bc:96d4 > ff02::16: HBH ICMP6, multicast listener report v2, 1 group record(s), length 28
18:29:04.694449 00:12:41:50:b7:45 > ff:ff:ff:ff:ff:ff, ethertype Unknown (0x8033), length 416: 
	0x0000:  2101 01f6 0000 0000 0604 0400 f7bc 0012  !...............
	0x0010:  4150 b745 ac10 1114 ffff ffff ffff 0000  AP.E............
	0x0020:  0000 ffff fc00 4453 2d32 4344 3354 3230  ......DS-2CD3T20
	0x0030:  442d 4933 6332 3764 3337 3539 3432 3266  D-I3c27d3759422f
	0x0040:  3138 3635 0000 0000 0000 0000 0000 0000  1865............
	0x0050:  0000 0000 0000 0002 200f 0000 1f40 0000  .............@..
	0x0060:  0000 0000 0000 5635 2e34 2e30 6275 696c  ......V5.4.0buil
	0x0070:  6420 3136 3036 3031 0000 0000 0000 0000  d.160601........
	0x0080:  0000 0000 0000 0000 0000 0000 0000 0000  ................
	0x0090:  0000 0000 0000 5637 2e33 2062 7569 6c64  ......V7.3.build
	0x00a0:  2031 3630 3731 3300 0000 0000 0000 0000  .160713.........
	0x00b0:  0000 0000 0000 0000 0000 0000 0000 0000  ................
	0x00c0:  0000 0000 0000 3230 3232 2d30 382d 3238  ......2022-08-28
	0x00d0:  2030 373a 3134 3a35 3200 0000 0000 0000  .07:14:52.......
	0x00e0:  0000 0000 0000 0000 0000 0000 0000 0000  ................
	0x00f0:  0000 0000 0000 029c 89db ac10 1001 0000  ................
	0x0100:  0000 0000 0000 0000 0000 0000 0000 0000  ................
	0x0110:  0000 0000 0000 0000 0000 0000 0000 004f  ...............O
	0x0120:  0000 0000 0000 0000 0000 0000 0000 0000  ................
	0x0130:  0000 0000 0000 0000 0000 0000 0000 0050  ...............P
	0x0140:  0000 0000 0000 0000 0000 4453 2d32 4344  ..........DS-2CD
	0x0150:  5654 2d43 4d4d 2d53 0000 0000 0000 0000  VT-CMM-S........
	0x0160:  0000 4453 2d32 4344 3354 3230 442d 4933  ..DS-2CD3T20D-I3
	0x0170:  0000 0000 0000 0000 0000 0000 0000 0000  ................
	0x0180:  0000 0000 0000 0000 0000 0000 0000 0000  ................
	0x0190:  0000                                     ..
18:29:04.715954 IP 172.16.22.141.54358 > 34.120.52.64.443: Flags [.], ack 40, win 501, options [nop,nop,TS val 1593426504 ecr 340174654], length 0
18:29:04.736805 IP 172.16.21.197.52611 > 255.255.255.255.5353: 512 PTR (QM)? _nvstream_dbd._tcp.local. (42)
18:29:04.749555 IP 172.16.16.60.3707 > 255.255.255.255.3702: UDP, length 1033
18:29:04.749555 IP 172.16.16.60.3707 > 255.255.255.255.3702: UDP, length 1033
18:29:04.749555 IP 172.16.16.60.3707 > 255.255.255.255.3702: UDP, length 1030
18:29:04.749905 IP 172.16.16.60.3707 > 255.255.255.255.3702: UDP, length 1030
18:29:04.749905 IP 172.16.16.60.37020 > 239.255.255.250.37020: UDP, length 142
18:29:04.749905 IP 172.16.16.60.37810 > 239.255.255.251.37810: UDP, length 94
18:29:04.749905 IP 172.16.16.60.5050 > 255.255.255.255.5050: UDP, length 32
18:29:04.749906 IP 172.16.16.60.34569 > 255.255.255.255.34569: UDP, length 20
18:29:04.749906 IP 172.16.16.60.18153 > 255.255.255.255.18152: UDP, length 12
18:29:04.750685 IP 172.16.16.60.3705 > 239.255.255.250.3702: UDP, length 1012
18:29:04.750891 IP 172.16.16.60.3705 > 239.255.255.250.3702: UDP, length 1012
18:29:04.751443 IP 172.16.16.63.37020 > 239.255.255.250.37020: UDP, length 1439
18:29:04.752260 IP 172.16.16.12.37020 > 239.255.255.250.37020: UDP, bad length 1523 > 1472
18:29:04.752261 IP 172.16.16.12 > 239.255.255.250: ip-proto-17
18:29:04.760161 IP 172.16.16.62.54382 > 255.255.255.255.3707: UDP, bad length 2101 > 1472
18:29:04.760162 IP 172.16.16.62 > 255.255.255.255: ip-proto-17
18:29:04.760338 IP 172.16.18.231.3702 > 239.255.255.250.3702: UDP, bad length 1754 > 1472
18:29:04.760338 IP 172.16.18.231 > 239.255.255.250: ip-proto-17
18:29:04.761927 IP 172.16.18.235.3702 > 239.255.255.250.3702: UDP, bad length 1754 > 1472
18:29:04.761957 IP 172.16.18.235 > 239.255.255.250: ip-proto-17
18:29:04.763058 IP 172.16.18.221.3702 > 239.255.255.250.3702: UDP, bad length 1754 > 1472
18:29:04.763058 IP 172.16.18.221 > 239.255.255.250: ip-proto-17
18:29:04.763173 IP 172.16.18.224.3702 > 239.255.255.250.3702: UDP, bad length 1754 > 1472
18:29:04.763190 IP 172.16.18.224 > 239.255.255.250: ip-proto-17
18:29:04.763572 IP 172.16.18.226.3702 > 239.255.255.250.3702: UDP, bad length 1754 > 1472
18:29:04.763616 IP 172.16.18.226 > 239.255.255.250: ip-proto-17
18:29:04.765318 IP 172.16.22.141.33348 > 142.250.67.46.443: Flags [P.], seq 2079838621:2079838645, ack 4192823869, win 364, options [nop,nop,TS val 3106155476 ecr 2255468980], length 24
18:29:04.765504 IP 172.16.18.228.3702 > 239.255.255.250.3702: UDP, bad length 1754 > 1472
18:29:04.765625 IP 172.16.18.232.3702 > 239.255.255.250.3702: UDP, bad length 1754 > 1472
18:29:04.765643 IP 172.16.18.228 > 239.255.255.250: ip-proto-17
18:29:04.765676 IP 172.16.18.232 > 239.255.255.250: ip-proto-17
18:29:04.765803 IP 172.16.18.212.3702 > 239.255.255.250.3702: UDP, bad length 1754 > 1472
18:29:04.765820 IP 172.16.18.212 > 239.255.255.250: ip-proto-17
18:29:04.765880 IP 172.16.22.141.33348 > 142.250.67.46.443: Flags [F.], seq 24, ack 1, win 364, options [nop,nop,TS val 3106155477 ecr 2255468980], length 0
18:29:04.766568 IP 172.16.18.239.3702 > 239.255.255.250.3702: UDP, bad length 1754 > 1472
18:29:04.766616 IP 172.16.18.239 > 239.255.255.250: ip-proto-17
18:29:04.766939 IP 172.16.18.230.3702 > 239.255.255.250.3702: UDP, bad length 1754 > 1472
18:29:04.766995 IP 172.16.18.230 > 239.255.255.250: ip-proto-17
18:29:04.767436 IP 172.16.18.222.3702 > 239.255.255.250.3702: UDP, bad length 1754 > 1472
18:29:04.767664 IP 172.16.18.222 > 239.255.255.250: ip-proto-17
18:29:04.768305 IP 172.16.18.219.3702 > 239.255.255.250.3702: UDP, bad length 1754 > 1472
18:29:04.768305 IP 172.16.18.219 > 239.255.255.250: ip-proto-17
18:29:04.770026 IP 172.16.18.210.3702 > 239.255.255.250.3702: UDP, bad length 1754 > 1472
18:29:04.770070 IP 172.16.18.210 > 239.255.255.250: ip-proto-17
18:29:04.770172 IP 172.16.18.204.3702 > 239.255.255.250.3702: UDP, bad length 1754 > 1472
18:29:04.770189 IP 172.16.18.204 > 239.255.255.250: ip-proto-17
