14:08:38.706539 ARP, Request who-has 172.16.16.42 tell 172.16.21.120, length 46
14:08:38.784930 ARP, Request who-has 172.16.18.253 tell 172.16.20.66, length 46
14:08:38.796031 ARP, Request who-has 172.16.16.66 tell 172.16.20.250, length 46
14:08:38.796033 ARP, Request who-has 172.16.16.67 tell 172.16.20.250, length 46
14:08:38.826962 ARP, Request who-has 172.16.19.26 tell 0.0.0.0, length 46
14:08:38.832827 ARP, Request who-has 172.16.19.27 tell 0.0.0.0, length 46
14:08:38.854938 IP 172.16.16.1.67 > 255.255.255.255.68: BOOTP/DHCP, Reply, length 278
14:08:38.856759 ARP, Request who-has 172.16.16.61 tell 172.16.16.61, length 46
14:08:38.869140 ARP, Request who-has 192.168.1.121 tell 192.168.1.1, length 46
14:08:38.918865 IP 172.16.23.122.49974 > 239.255.255.250.1900: UDP, length 125
14:08:38.944887 IP 172.16.16.45.45088 > 255.255.255.255.7437: UDP, length 173
14:08:39.127136 ARP, Request who-has 172.16.18.201 tell 172.16.16.61, length 46
14:08:39.158047 ARP, Request who-has 172.16.19.5 tell 0.0.0.0, length 46
14:08:39.171229 ARP, Request who-has 172.16.16.213 tell 172.16.20.66, length 46
14:08:39.171230 ARP, Request who-has 172.16.16.37 tell 172.16.20.66, length 46
14:08:39.171230 ARP, Request who-has 172.16.16.5 tell 172.16.20.66, length 46
14:08:39.171231 ARP, Request who-has 172.16.19.66 tell 172.16.20.66, length 46
14:08:39.173694 ARP, Request who-has 172.16.19.43 tell 0.0.0.0, length 46
14:08:39.196697 IP 192.168.1.1.67 > 255.255.255.255.68: BOOTP/DHCP, Reply, length 300
14:08:39.254894 IP 172.16.23.3.51579 > 239.255.255.250.1900: UDP, length 175
14:08:39.301452 IP 172.16.23.3.51580 > 239.255.255.250.1900: UDP, length 175
14:08:39.312766 ARP, Request who-has 172.16.19.2 tell 0.0.0.0, length 46
14:08:39.322992 ARP, Request who-has 172.16.21.243 tell 172.16.16.3, length 46
14:08:39.398765 ARP, Request who-has 172.16.16.249 tell 172.16.16.202, length 46
14:08:39.427332 IP 172.16.20.14.51354 > 255.255.255.255.3956: UDP, length 8
14:08:39.451455 ARP, Request who-has 172.16.16.42 tell 172.16.21.120, length 46
14:08:39.475209 ARP, Request who-has 172.16.19.12 tell 0.0.0.0, length 46
14:08:39.502886 ARP, Request who-has 172.16.17.4 tell 172.16.16.60, length 46
14:08:39.502888 ARP, Request who-has 172.16.17.2 tell 172.16.16.60, length 46
14:08:39.502888 ARP, Request who-has 172.16.17.9 tell 172.16.16.60, length 46
14:08:39.502888 ARP, Request who-has 172.16.17.1 tell 172.16.16.60, length 46
14:08:39.502889 ARP, Request who-has 172.16.17.21 tell 172.16.16.60, length 46
14:08:39.502889 ARP, Request who-has 172.16.17.19 tell 172.16.16.60, length 46
14:08:39.502890 ARP, Request who-has 172.16.17.22 tell 172.16.16.60, length 46
14:08:39.502890 ARP, Request who-has 172.16.17.15 tell 172.16.16.60, length 46
14:08:39.502909 ARP, Request who-has 172.16.17.11 tell 172.16.16.60, length 46
14:08:39.502910 ARP, Request who-has 172.16.17.12 tell 172.16.16.60, length 46
14:08:39.506062 IP6 fe80::2c0a:4b3a:180e:d317.5353 > ff02::fb.5353: 0 [7q] PTR (QM)? _ftp._tcp.local. PTR (QM)? _nfs._tcp.local. PTR (QM)? _afpovertcp._tcp.local. PTR (QM)? _smb._tcp.local. PTR (QM)? _sftp-ssh._tcp.local. PTR (QM)? _webdavs._tcp.local. PTR (QM)? _webdav._tcp.local. (118)
14:08:39.506064 IP 172.16.19.128.5353 > 224.0.0.251.5353: 0 [7q] PTR (QM)? _ftp._tcp.local. PTR (QM)? _nfs._tcp.local. PTR (QM)? _afpovertcp._tcp.local. PTR (QM)? _smb._tcp.local. PTR (QM)? _sftp-ssh._tcp.local. PTR (QM)? _webdavs._tcp.local. PTR (QM)? _webdav._tcp.local. (118)
14:08:39.566122 ARP, Request who-has 172.16.18.208 tell 172.16.16.61, length 46
14:08:39.629695 IP 172.16.21.197.65521 > 255.255.255.255.5353: 38400 PTR (QM)? _nvstream_dbd._tcp.local. (42)
14:08:39.673067 ARP, Request who-has 172.16.19.66 tell 172.16.20.63, length 46
14:08:39.762551 ARP, Request who-has 169.254.114.82 tell 0.0.0.0, length 46
14:08:39.804174 IP6 fe80::50a3:a7be:c300:446c.53372 > ff02::c.1900: UDP, length 146
14:08:39.839878 ARP, Request who-has 172.16.19.6 tell 0.0.0.0, length 46
14:08:39.864472 IP 172.16.20.14.64002 > 255.255.255.255.3956: UDP, length 8
14:08:40.033938 IP 172.16.20.14.64443 > 255.255.255.255.3956: UDP, length 8
14:08:40.110650 ARP, Request who-has 172.16.18.209 tell 172.16.16.61, length 46
14:08:40.132405 IP 172.16.22.141.1716 > 10.42.0.213.1716: UDP, bad length 1798 > 1472
14:08:40.132411 IP 172.16.22.141 > 10.42.0.213: ip-proto-17
14:08:40.140662 ARP, Request who-has 172.16.18.201 tell 172.16.16.61, length 46
14:08:40.190967 ARP, Request who-has 172.16.16.42 tell 172.16.22.173, length 46
14:08:40.193573 ARP, Request who-has 172.16.19.41 tell 0.0.0.0, length 46
14:08:40.199468 IP 139.59.32.29.80 > 172.16.22.141.58712: Flags [F.], seq 2797832930, ack 1640197883, win 432, options [nop,nop,TS val 3592428858 ecr 10315094], length 0
14:08:40.225303 ARP, Request who-has 172.16.16.42 tell 172.16.21.120, length 46
14:08:40.242552 IP 172.16.22.141.58712 > 139.59.32.29.80: Flags [.], ack 1, win 1767, options [nop,nop,TS val 10380172 ecr 3592428858], length 0
14:08:40.309661 ARP, Request who-has 172.16.19.37 tell 0.0.0.0, length 46
14:08:40.309662 ARP, Request who-has 172.16.18.253 tell 172.16.22.205, length 46
14:08:40.435631 IP 192.168.1.1.48727 > 255.255.255.255.7437: UDP, length 173
14:08:40.457062 IP 172.16.16.44.35218 > 255.255.255.255.7437: UDP, length 173
14:08:40.516690 ARP, Request who-has 172.16.17.1 tell 172.16.16.60, length 46
14:08:40.516691 ARP, Request who-has 172.16.17.2 tell 172.16.16.60, length 46
14:08:40.516692 ARP, Request who-has 172.16.17.4 tell 172.16.16.60, length 46
14:08:40.516692 ARP, Request who-has 172.16.17.9 tell 172.16.16.60, length 46
14:08:40.516692 ARP, Request who-has 172.16.17.21 tell 172.16.16.60, length 46
14:08:40.516693 ARP, Request who-has 172.16.17.19 tell 172.16.16.60, length 46
14:08:40.516693 ARP, Request who-has 172.16.17.22 tell 172.16.16.60, length 46
14:08:40.516694 ARP, Request who-has 172.16.17.11 tell 172.16.16.60, length 46
14:08:40.516713 ARP, Request who-has 172.16.17.15 tell 172.16.16.60, length 46
14:08:40.516713 ARP, Request who-has 172.16.17.12 tell 172.16.16.60, length 46
14:08:40.520574 IP6 fe80::b03f:c897:6ca0:dcc5.5353 > ff02::fb.5353: 45914 PTR (QM)? _arduino._tcp.local. (37)
14:08:40.586531 IP 192.168.1.1.56696 > 224.0.0.251.5353: 4473 PTR (QM)? 192.168.1.10.in-addr.arpa. (43)
14:08:40.596654 IP 192.168.1.1.49173 > 224.0.0.251.5353: 4474 PTR (QM)? 192.168.1.10.in-addr.arpa. (43)
14:08:40.660672 IP 172.16.19.62.52473 > 239.255.255.250.1900: UDP, length 175
14:08:40.721656 IP 172.16.16.61.40623 > 239.255.255.250.1900: UDP, length 137
14:08:40.863702 ARP, Request who-has 172.16.19.154 (ff:ff:ff:ff:ff:ff) tell 172.16.16.1, length 46
14:08:40.863704 ARP, Request who-has 172.16.19.198 (ff:ff:ff:ff:ff:ff) tell 172.16.16.1, length 46
14:08:40.864178 ARP, Request who-has 172.16.23.67 (ff:ff:ff:ff:ff:ff) tell 172.16.16.1, length 46
14:08:40.875646 IP 0.0.0.0.68 > 255.255.255.255.67: BOOTP/DHCP, Request from 00:00:00:00:09:ab, length 300
14:08:40.890552 IP 192.168.1.1.67 > 255.255.255.255.68: BOOTP/DHCP, Reply, length 300
14:08:40.891909 IP 172.16.16.1.67 > 255.255.255.255.68: BOOTP/DHCP, Reply, length 278
14:08:40.899637 IP6 fe80::54ce:277b:b210:e6ee.546 > ff02::1:2.547: dhcp6 inf-req
14:08:40.923062 ARP, Request who-has 172.16.16.42 tell 172.16.22.173, length 46
14:08:41.000218 ARP, Request who-has 172.16.16.42 tell 172.16.21.120, length 46
14:08:41.104732 ARP, Request who-has 172.16.18.209 tell 172.16.16.61, length 46
14:08:41.191653 IP 172.16.20.157.17500 > 172.16.23.255.17500: UDP, length 133
14:08:41.465127 ARP, Request who-has 172.16.19.1 tell 172.16.16.62, length 46
14:08:41.465128 ARP, Request who-has 172.16.19.2 tell 172.16.16.62, length 46
14:08:41.465129 ARP, Request who-has 172.16.19.3 tell 172.16.16.62, length 46
14:08:41.465930 ARP, Request who-has 172.16.19.13 tell 172.16.16.62, length 46
14:08:41.465931 ARP, Request who-has 172.16.19.15 tell 172.16.16.62, length 46
14:08:41.465968 ARP, Request who-has 172.16.19.14 tell 172.16.16.62, length 46
14:08:41.466197 ARP, Request who-has 172.16.19.27 tell 172.16.16.62, length 46
14:08:41.466197 ARP, Request who-has 172.16.19.28 tell 172.16.16.62, length 46
14:08:41.466215 ARP, Request who-has 172.16.19.30 tell 172.16.16.62, length 46
14:08:41.466216 ARP, Request who-has 172.16.19.29 tell 172.16.16.62, length 46
14:08:41.466230 ARP, Request who-has 172.16.19.26 tell 172.16.16.62, length 46
14:08:41.466230 ARP, Request who-has 172.16.19.31 tell 172.16.16.62, length 46
14:08:41.466955 ARP, Request who-has 172.16.19.39 (d0:67:b8:b4:18:8e) tell 172.16.16.62, length 46
14:08:41.475468 ARP, Request who-has 172.16.19.12 (f0:2e:fd:ab:18:8e) tell 172.16.16.62, length 46
14:08:41.511622 ARP, Request who-has 172.16.17.1 tell 172.16.16.60, length 46
14:08:41.511623 ARP, Request who-has 172.16.17.9 tell 172.16.16.60, length 46
14:08:41.511624 ARP, Request who-has 172.16.17.4 tell 172.16.16.60, length 46
14:08:41.511624 ARP, Request who-has 172.16.17.2 tell 172.16.16.60, length 46
14:08:41.511625 ARP, Request who-has 172.16.17.19 tell 172.16.16.60, length 46
14:08:41.511625 ARP, Request who-has 172.16.17.21 tell 172.16.16.60, length 46
14:08:41.511625 ARP, Request who-has 172.16.17.11 tell 172.16.16.60, length 46
14:08:41.511626 ARP, Request who-has 172.16.17.22 tell 172.16.16.60, length 46
14:08:41.511641 ARP, Request who-has 172.16.17.15 tell 172.16.16.60, length 46
14:08:41.511642 ARP, Request who-has 172.16.17.12 tell 172.16.16.60, length 46
14:08:41.537636 ARP, Request who-has 172.16.17.13 tell 172.16.16.60, length 46
14:08:41.537637 ARP, Request who-has 172.16.17.10 tell 172.16.16.60, length 46
14:08:41.564616 IP 172.16.20.14.51354 > 255.255.255.255.3956: UDP, length 8
14:08:41.591499 IP 172.16.16.43.33897 > 255.255.255.255.7437: UDP, length 173
14:08:41.603831 ARP, Request who-has 172.16.19.4 tell 0.0.0.0, length 46
14:08:41.669300 IP 172.16.19.62.52473 > 239.255.255.250.1900: UDP, length 175
14:08:41.686461 IP 172.16.20.99.60515 > 239.255.255.250.1900: UDP, length 101
14:08:41.741066 ARP, Request who-has 172.16.19.1 tell 0.0.0.0, length 46
14:08:41.767731 IP6 fe80::3dd0:2628:8b28:d13a.546 > ff02::1:2.547: dhcp6 solicit
14:08:41.778971 ARP, Request who-has 172.16.16.42 tell 172.16.21.120, length 46
14:08:41.819647 ARP, Request who-has 172.16.16.62 tell 0.0.0.0, length 46
14:08:41.918518 ARP, Request who-has 172.16.16.42 tell 172.16.22.173, length 46
14:08:42.000466 IP 172.16.20.14.64002 > 255.255.255.255.3956: UDP, length 8
14:08:42.021936 IP 172.16.16.45.45088 > 255.255.255.255.7437: UDP, length 173
14:08:42.085335 IP 172.16.22.141.32916 > 107.167.110.211.443: Flags [F.], seq 2628392494, ack 1540586727, win 501, options [nop,nop,TS val 2867005952 ecr 2812726919], length 0
14:08:42.085410 IP 172.16.22.141.32914 > 107.167.110.211.443: Flags [R.], seq 1247385214, ack 1768015778, win 501, options [nop,nop,TS val 2867005952 ecr 2812732036], length 0
14:08:42.085456 IP 172.16.22.141.50558 > 107.167.110.216.443: Flags [F.], seq 1208143000, ack 892866625, win 501, options [nop,nop,TS val 3849231371 ecr 2025763097], length 0
14:08:42.085490 IP 172.16.22.141.50556 > 107.167.110.216.443: Flags [R.], seq 3809667625, ack 1693775937, win 501, options [nop,nop,TS val 3849231371 ecr 2025768174], length 0
14:08:42.086213 IP 172.16.22.141.52485 > 8.8.8.8.53: 56248+ [1au] A? sitecheck.opera.com. (48)
14:08:42.119531 IP 172.16.22.141.59692 > 142.250.193.101.443: Flags [.], seq 4261301801:4261303219, ack 50582226, win 1336, options [nop,nop,TS val 3782084877 ecr 1053029137], length 1418
14:08:42.119532 IP 172.16.22.141.59692 > 142.250.193.101.443: Flags [P.], seq 1418:2706, ack 1, win 1336, options [nop,nop,TS val 3782084877 ecr 1053029137], length 1288
14:08:42.119570 IP 172.16.22.141.59692 > 142.250.193.101.443: Flags [P.], seq 2706:2745, ack 1, win 1336, options [nop,nop,TS val 3782084877 ecr 1053029137], length 39
14:08:42.141941 ARP, Request who-has 172.16.19.14 tell 0.0.0.0, length 46
14:08:42.148129 IP 8.8.8.8.53 > 172.16.22.141.52485: 56248 7/0/1 CNAME sitecheck.geo.opera.com., CNAME lati-sitecheck.opera.com., CNAME lati.lb.opera.technology., A 107.167.110.216, A 107.167.110.211, A 107.167.110.224, A 107.167.110.223 (207)
14:08:42.148723 IP 172.16.22.141.34144 > 107.167.110.223.443: Flags [S], seq 3790653514, win 64240, options [mss 1460,sackOK,TS val 1558447224 ecr 0,nop,wscale 7], length 0
14:08:42.151500 IP 142.250.193.101.443 > 172.16.22.141.59692: Flags [P.], seq 1:40, ack 2745, win 405, options [nop,nop,TS val 1053055751 ecr 3782084877], length 39
14:08:42.172086 IP 172.16.20.14.64443 > 255.255.255.255.3956: UDP, length 8
14:08:42.194491 IP 172.16.22.141.59692 > 142.250.193.101.443: Flags [.], ack 40, win 1336, options [nop,nop,TS val 3782084952 ecr 1053055751], length 0
14:08:42.251328 ARP, Request who-has 172.16.18.208 tell 172.16.16.61, length 46
14:08:42.301754 IP 107.167.110.211.443 > 172.16.22.141.32910: Flags [P.], seq 4123055469:4123055493, ack 591819729, win 83, options [nop,nop,TS val 2812741368 ecr 2866941153], length 24
14:08:42.301779 IP 172.16.22.141.32910 > 107.167.110.211.443: Flags [.], ack 24, win 501, options [nop,nop,TS val 2867006169 ecr 2812741368], length 0
14:08:42.301783 IP 107.167.110.211.443 > 172.16.22.141.32910: Flags [F.], seq 24, ack 1, win 83, options [nop,nop,TS val 2812741368 ecr 2866941153], length 0
14:08:42.336381 IP 172.16.22.141.34146 > 107.167.110.223.443: Flags [S], seq 1883372280, win 64240, options [mss 1460,sackOK,TS val 1558447411 ecr 0,nop,wscale 7], length 0
14:08:42.342441 IP 172.16.22.141.32910 > 107.167.110.211.443: Flags [.], ack 25, win 501, options [nop,nop,TS val 2867006209 ecr 2812741368], length 0
14:08:42.355920 IP 107.167.110.211.443 > 172.16.22.141.32916: Flags [.], ack 1, win 84, options [nop,nop,TS val 2812741437 ecr 2867005952], length 0
14:08:42.356164 ARP, Request who-has 172.16.19.7 tell 0.0.0.0, length 46
14:08:42.364088 IP 139.59.32.29.80 > 172.16.22.141.58716: Flags [F.], seq 2277810877, ack 1603718479, win 308, options [nop,nop,TS val 3592431013 ecr 10317214], length 0
14:08:42.406542 IP 172.16.22.141.58716 > 139.59.32.29.80: Flags [.], ack 1, win 1208, options [nop,nop,TS val 10382336 ecr 3592431013], length 0
14:08:42.423294 IP 107.167.110.223.443 > 172.16.22.141.34144: Flags [S.], seq 381683029, ack 3790653515, win 43440, options [mss 1460,sackOK,TS val 2277205201 ecr 1558447224,nop,wscale 9], length 0
14:08:42.423372 IP 172.16.22.141.34144 > 107.167.110.223.443: Flags [.], ack 1, win 502, options [nop,nop,TS val 1558447498 ecr 2277205201], length 0
14:08:42.423846 IP 172.16.22.141.34144 > 107.167.110.223.443: Flags [P.], seq 1:518, ack 1, win 502, options [nop,nop,TS val 1558447499 ecr 2277205201], length 517
14:08:42.467950 ARP, Request who-has 172.16.19.3 tell 172.16.16.62, length 46
14:08:42.467951 ARP, Request who-has 172.16.19.1 tell 172.16.16.62, length 46
14:08:42.467952 ARP, Request who-has 172.16.19.2 tell 172.16.16.62, length 46
14:08:42.467952 ARP, Request who-has 172.16.19.15 tell 172.16.16.62, length 46
14:08:42.467953 ARP, Request who-has 172.16.19.14 tell 172.16.16.62, length 46
14:08:42.467953 ARP, Request who-has 172.16.19.13 tell 172.16.16.62, length 46
14:08:42.467953 ARP, Request who-has 172.16.19.27 tell 172.16.16.62, length 46
14:08:42.467954 ARP, Request who-has 172.16.19.28 tell 172.16.16.62, length 46
14:08:42.467972 ARP, Request who-has 172.16.19.30 tell 172.16.16.62, length 46
14:08:42.467973 ARP, Request who-has 172.16.19.29 tell 172.16.16.62, length 46
14:08:42.467973 ARP, Request who-has 172.16.19.31 tell 172.16.16.62, length 46
14:08:42.467973 ARP, Request who-has 172.16.19.26 tell 172.16.16.62, length 46
14:08:42.536747 IP 142.250.193.101.443 > 172.16.22.141.59692: Flags [P.], seq 942:2360, ack 2745, win 405, options [nop,nop,TS val 1053056137 ecr 3782084952], length 1418
14:08:42.536785 IP 172.16.22.141.59692 > 142.250.193.101.443: Flags [.], ack 40, win 1336, options [nop,nop,TS val 3782085294 ecr 1053055751,nop,nop,sack 1 {942:2360}], length 0
14:08:42.537608 IP 142.250.193.101.443 > 172.16.22.141.59692: Flags [.], seq 2360:3778, ack 2745, win 405, options [nop,nop,TS val 1053056137 ecr 3782084952], length 1418
14:08:42.537624 IP 172.16.22.141.59692 > 142.250.193.101.443: Flags [.], ack 40, win 1336, options [nop,nop,TS val 3782085295 ecr 1053055751,nop,nop,sack 1 {942:3778}], length 0
14:08:42.537810 IP 142.250.193.101.443 > 172.16.22.141.59692: Flags [P.], seq 3778:5196, ack 2745, win 405, options [nop,nop,TS val 1053056137 ecr 3782084952], length 1418
14:08:42.537814 IP 172.16.22.141.59692 > 142.250.193.101.443: Flags [.], ack 40, win 1336, options [nop,nop,TS val 3782085295 ecr 1053055751,nop,nop,sack 1 {942:5196}], length 0
14:08:42.538372 IP 142.250.193.101.443 > 172.16.22.141.59692: Flags [P.], seq 5196:5382, ack 2745, win 405, options [nop,nop,TS val 1053056138 ecr 3782084952], length 186
14:08:42.538390 IP 172.16.22.141.59692 > 142.250.193.101.443: Flags [.], ack 40, win 1336, options [nop,nop,TS val 3782085295 ecr 1053055751,nop,nop,sack 1 {942:5382}], length 0
14:08:42.540167 IP 142.250.193.101.443 > 172.16.22.141.59692: Flags [P.], seq 5382:6800, ack 2745, win 405, options [nop,nop,TS val 1053056140 ecr 3782084952], length 1418
14:08:42.540210 IP 172.16.22.141.59692 > 142.250.193.101.443: Flags [.], ack 40, win 1336, options [nop,nop,TS val 3782085297 ecr 1053055751,nop,nop,sack 1 {942:6800}], length 0
14:08:42.540599 IP 142.250.193.101.443 > 172.16.22.141.59692: Flags [.], seq 6800:8218, ack 2745, win 405, options [nop,nop,TS val 1053056140 ecr 3782084952], length 1418
14:08:42.540618 IP 172.16.22.141.59692 > 142.250.193.101.443: Flags [.], ack 40, win 1336, options [nop,nop,TS val 3782085298 ecr 1053055751,nop,nop,sack 1 {942:8218}], length 0
14:08:42.540712 IP 142.250.193.101.443 > 172.16.22.141.59692: Flags [P.], seq 8218:9636, ack 2745, win 405, options [nop,nop,TS val 1053056140 ecr 3782084952], length 1418
14:08:42.540722 IP 172.16.22.141.59692 > 142.250.193.101.443: Flags [.], ack 40, win 1336, options [nop,nop,TS val 3782085298 ecr 1053055751,nop,nop,sack 1 {942:9636}], length 0
14:08:42.564117 ARP, Request who-has 172.16.17.15 tell 172.16.16.60, length 46
14:08:42.564118 ARP, Request who-has 172.16.17.19 tell 172.16.16.60, length 46
14:08:42.568068 IP 142.250.193.101.443 > 172.16.22.141.59692: Flags [P.], seq 40:942, ack 2745, win 405, options [nop,nop,TS val 1053056169 ecr 3782085295], length 902
14:08:42.568125 IP 172.16.22.141.59692 > 142.250.193.101.443: Flags [.], ack 9636, win 1283, options [nop,nop,TS val 3782085325 ecr 1053056169], length 0
14:08:42.571722 IP 172.16.22.141.59692 > 142.250.193.101.443: Flags [P.], seq 2745:2780, ack 9636, win 1341, options [nop,nop,TS val 3782085329 ecr 1053056169], length 35
14:08:42.597366 IP 142.250.193.101.443 > 172.16.22.141.59692: Flags [.], seq 9636:11054, ack 2745, win 405, options [nop,nop,TS val 1053056199 ecr 3782085325], length 1418
14:08:42.597385 IP 172.16.22.141.59692 > 142.250.193.101.443: Flags [.], ack 11054, win 1332, options [nop,nop,TS val 3782085354 ecr 1053056199], length 0
14:08:42.597447 IP 142.250.193.101.443 > 172.16.22.141.59692: Flags [P.], seq 11054:12207, ack 2745, win 405, options [nop,nop,TS val 1053056199 ecr 3782085325], length 1153
14:08:42.597451 IP 172.16.22.141.59692 > 142.250.193.101.443: Flags [.], ack 12207, win 1333, options [nop,nop,TS val 3782085355 ecr 1053056199], length 0
14:08:42.597462 IP 142.250.193.101.443 > 172.16.22.141.59692: Flags [P.], seq 12207:12326, ack 2745, win 405, options [nop,nop,TS val 1053056199 ecr 3782085325], length 119
14:08:42.597464 IP 172.16.22.141.59692 > 142.250.193.101.443: Flags [.], ack 12326, win 1333, options [nop,nop,TS val 3782085355 ecr 1053056199], length 0
14:08:42.597919 IP 172.16.22.141.59692 > 142.250.193.101.443: Flags [P.], seq 2780:2819, ack 12326, win 1341, options [nop,nop,TS val 3782085355 ecr 1053056199], length 39
14:08:42.606122 IP 142.250.193.101.443 > 172.16.22.141.59692: Flags [.], ack 2780, win 405, options [nop,nop,TS val 1053056207 ecr 3782085329], length 0
14:08:42.646174 IP 172.16.21.197.65525 > 255.255.255.255.5353: 40960 PTR (QM)? _ni-logos._tcp.local. (38)
14:08:42.681484 IP 172.16.19.62.52473 > 239.255.255.250.1900: UDP, length 175
14:08:42.710834 IP 172.16.22.141.48368 > 142.250.195.131.443: UDP, length 1250
14:08:42.711026 IP 172.16.22.141.48368 > 142.250.195.131.443: UDP, length 78
14:08:42.711227 IP 172.16.22.141.48368 > 142.250.195.131.443: UDP, length 444
14:08:42.741749 ARP, Request who-has 172.16.18.206 tell 172.16.16.61, length 46
14:08:42.746586 IP 172.16.22.141.58712 > 139.59.32.29.80: Flags [F.], seq 1, ack 1, win 1767, options [nop,nop,TS val 10382676 ecr 3592428858], length 0
14:08:42.746615 IP 172.16.22.141.58716 > 139.59.32.29.80: Flags [F.], seq 1, ack 1, win 1208, options [nop,nop,TS val 10382676 ecr 3592431013], length 0
14:08:42.746641 IP 172.16.22.141.32910 > 107.167.110.211.443: Flags [R.], seq 1, ack 25, win 501, options [nop,nop,TS val 2867006614 ecr 2812741368], length 0
14:08:42.747101 IP 172.16.22.141.38999 > 8.8.8.8.53: 18635+ [1au] A? af.opera.com. (41)
14:08:42.767162 ARP, Request who-has 172.16.19.10 tell 0.0.0.0, length 46
14:08:42.771037 IP 142.250.195.131.443 > 172.16.22.141.48368: UDP, length 1250
14:08:42.771485 IP6 fe80::3dd0:2628:8b28:d13a.546 > ff02::1:2.547: dhcp6 solicit
14:08:42.777084 IP 8.8.8.8.53 > 172.16.22.141.38999: 18635 6/0/1 CNAME af.geo.opera.com., CNAME lati-af.opera.com., A 107.167.110.211, A 107.167.110.223, A 107.167.110.216, A 107.167.110.224 (148)
14:08:42.777667 IP 172.16.22.141.58860 > 107.167.110.224.443: Flags [S], seq 99879459, win 64240, options [mss 1460,sackOK,TS val 422833568 ecr 0,nop,wscale 7], length 0
14:08:42.779078 IP 142.250.195.131.443 > 172.16.22.141.48368: UDP, length 1250
14:08:42.779129 IP 142.250.195.131.443 > 172.16.22.141.48368: UDP, length 790
14:08:42.779145 IP 142.250.195.131.443 > 172.16.22.141.48368: UDP, length 69
14:08:42.779146 IP 142.250.195.131.443 > 172.16.22.141.48368: UDP, length 25
14:08:42.779489 IP 172.16.22.141.48368 > 142.250.195.131.443: UDP, length 78
14:08:42.779542 IP 172.16.22.141.48368 > 142.250.195.131.443: UDP, length 33
14:08:42.785624 IP 139.59.32.29.80 > 172.16.22.141.58712: Flags [.], ack 2, win 432, options [nop,nop,TS val 3592431438 ecr 10382676], length 0
14:08:42.789847 IP 139.59.32.29.80 > 172.16.22.141.58716: Flags [.], ack 2, win 308, options [nop,nop,TS val 3592431438 ecr 10382676], length 0
14:08:42.804941 IP 172.16.22.141.48368 > 142.250.195.131.443: UDP, length 33
14:08:42.813676 IP 142.250.195.131.443 > 172.16.22.141.48368: UDP, length 92
14:08:42.813850 IP 172.16.22.141.48368 > 142.250.195.131.443: UDP, length 33
14:08:42.830482 IP 172.16.22.141.59692 > 142.250.193.101.443: Flags [P.], seq 2780:2819, ack 12326, win 1341, options [nop,nop,TS val 3782085588 ecr 1053056207], length 39
14:08:42.834424 IP 172.16.22.141.50558 > 107.167.110.216.443: Flags [F.], seq 0, ack 1, win 501, options [nop,nop,TS val 3849232119 ecr 2025763097], length 0
14:08:42.843305 IP 142.250.195.131.443 > 172.16.22.141.48368: UDP, length 25
14:08:42.843512 IP 172.16.22.141.48368 > 142.250.195.131.443: UDP, length 35
14:08:42.855518 IP 142.250.195.131.443 > 172.16.22.141.48368: UDP, length 25
14:08:42.855791 IP 172.16.22.141.48368 > 142.250.195.131.443: UDP, length 35
14:08:42.870870 ARP, Request who-has 172.16.16.61 tell 172.16.16.61, length 46
14:08:42.886512 IP 142.250.195.131.443 > 172.16.22.141.48368: UDP, length 625
14:08:42.886929 IP 172.16.22.141.48368 > 142.250.195.131.443: UDP, length 39
14:08:42.945009 IP 142.250.195.131.443 > 172.16.22.141.48368: UDP, length 26
14:08:42.997742 IP 172.16.22.141.58862 > 107.167.110.224.443: Flags [S], seq 4105109912, win 64240, options [mss 1460,sackOK,TS val 422833788 ecr 0,nop,wscale 7], length 0
14:08:43.052624 IP 107.167.110.224.443 > 172.16.22.141.58860: Flags [S.], seq 154638609, ack 99879460, win 43440, options [mss 1460,sackOK,TS val 1032915602 ecr 422833568,nop,wscale 9], length 0
14:08:43.052696 IP 172.16.22.141.58860 > 107.167.110.224.443: Flags [.], ack 1, win 502, options [nop,nop,TS val 422833843 ecr 1032915602], length 0
14:08:43.053210 IP 172.16.22.141.58860 > 107.167.110.224.443: Flags [P.], seq 1:518, ack 1, win 502, options [nop,nop,TS val 422833843 ecr 1032915602], length 517
14:08:43.058558 IP 172.16.22.141.59692 > 142.250.193.101.443: Flags [P.], seq 2780:2819, ack 12326, win 1341, options [nop,nop,TS val 3782085816 ecr 1053056207], length 39
14:08:43.064877 IP 172.16.21.65.63138 > 239.255.255.250.1900: UDP, length 175
14:08:43.186536 IP 172.16.22.141.34144 > 107.167.110.223.443: Flags [P.], seq 1:518, ack 1, win 502, options [nop,nop,TS val 1558448262 ecr 2277205201], length 517
14:08:43.200634 ARP, Request who-has 172.16.16.42 tell 172.16.22.173, length 46
14:08:43.250530 ARP, Request who-has 172.16.18.208 tell 172.16.16.61, length 46
14:08:43.261574 ARP, Request who-has 172.16.18.207 tell 172.16.16.61, length 46
14:08:43.270741 IP 107.167.110.223.443 > 172.16.22.141.34144: Flags [P.], seq 2897:3141, ack 518, win 84, options [nop,nop,TS val 2277206047 ecr 1558447499], length 244
14:08:43.270790 IP 172.16.22.141.34144 > 107.167.110.223.443: Flags [.], ack 1, win 502, options [nop,nop,TS val 1558448346 ecr 2277205201,nop,nop,sack 1 {2897:3141}], length 0
14:08:43.300695 IP6 fe80::29a1:7e32:11bb:27a0.53815 > ff02::c.3702: UDP, length 656
14:08:43.327855 IP 107.167.110.224.443 > 172.16.22.141.58860: Flags [.], ack 518, win 83, options [nop,nop,TS val 1032915919 ecr 422833843], length 0
14:08:43.327882 IP 107.167.110.224.443 > 172.16.22.141.58860: Flags [.], seq 1:1449, ack 518, win 83, options [nop,nop,TS val 1032915919 ecr 422833843], length 1448
14:08:43.327897 IP 172.16.22.141.58860 > 107.167.110.224.443: Flags [.], ack 1449, win 501, options [nop,nop,TS val 422834118 ecr 1032915919], length 0
14:08:43.327963 IP 107.167.110.224.443 > 172.16.22.141.58860: Flags [P.], seq 1449:2897, ack 518, win 83, options [nop,nop,TS val 1032915919 ecr 422833843], length 1448
14:08:43.327971 IP 172.16.22.141.58860 > 107.167.110.224.443: Flags [.], ack 2897, win 495, options [nop,nop,TS val 422834118 ecr 1032915919], length 0
14:08:43.327973 IP 107.167.110.224.443 > 172.16.22.141.58860: Flags [P.], seq 2897:3141, ack 518, win 83, options [nop,nop,TS val 1032915920 ecr 422833843], length 244
14:08:43.327976 IP 172.16.22.141.58860 > 107.167.110.224.443: Flags [.], ack 3141, win 494, options [nop,nop,TS val 422834118 ecr 1032915920], length 0
14:08:43.329264 IP 172.16.22.141.58860 > 107.167.110.224.443: Flags [P.], seq 518:598, ack 3141, win 501, options [nop,nop,TS val 422834119 ecr 1032915920], length 80
14:08:43.329533 IP 172.16.22.141.58860 > 107.167.110.224.443: Flags [P.], seq 598:1105, ack 3141, win 501, options [nop,nop,TS val 422834120 ecr 1032915920], length 507
14:08:43.342531 ARP, Request who-has 169.254.239.20 tell 0.0.0.0, length 46
14:08:43.346561 IP 172.16.22.141.34146 > 107.167.110.223.443: Flags [S], seq 1883372280, win 64240, options [mss 1460,sackOK,TS val 1558448422 ecr 0,nop,wscale 7], length 0
14:08:43.469676 ARP, Request who-has 172.16.19.3 tell 172.16.16.62, length 46
14:08:43.469677 ARP, Request who-has 172.16.19.2 tell 172.16.16.62, length 46
14:08:43.469678 ARP, Request who-has 172.16.19.1 tell 172.16.16.62, length 46
14:08:43.469678 ARP, Request who-has 172.16.19.14 tell 172.16.16.62, length 46
14:08:43.469678 ARP, Request who-has 172.16.19.13 tell 172.16.16.62, length 46
14:08:43.469679 ARP, Request who-has 172.16.19.28 tell 172.16.16.62, length 46
14:08:43.469679 ARP, Request who-has 172.16.19.27 tell 172.16.16.62, length 46
14:08:43.469679 ARP, Request who-has 172.16.19.30 tell 172.16.16.62, length 46
14:08:43.469700 ARP, Request who-has 172.16.19.29 tell 172.16.16.62, length 46
14:08:43.469701 ARP, Request who-has 172.16.19.31 tell 172.16.16.62, length 46
14:08:43.469701 ARP, Request who-has 172.16.19.26 tell 172.16.16.62, length 46
14:08:43.469702 ARP, Request who-has 172.16.19.15 tell 172.16.16.62, length 46
14:08:43.489012 IP6 fe80::29a1:7e32:11bb:27a0.53815 > ff02::c.3702: UDP, length 656
14:08:43.493236 ARP, Request who-has 172.16.19.40 tell 0.0.0.0, length 46
14:08:43.526723 IP 172.16.16.44.35218 > 255.255.255.255.7437: UDP, length 173
14:08:43.535838 ARP, Request who-has 172.16.17.13 tell 172.16.16.60, length 46
14:08:43.535840 ARP, Request who-has 172.16.17.10 tell 172.16.16.60, length 46
14:08:43.538457 IP 172.16.22.141.59692 > 142.250.193.101.443: Flags [P.], seq 2780:2819, ack 12326, win 1341, options [nop,nop,TS val 3782086296 ecr 1053056207], length 39
14:08:43.546323 IP 107.167.110.223.443 > 172.16.22.141.34144: Flags [.], seq 1:1449, ack 518, win 84, options [nop,nop,TS val 2277206323 ecr 1558448346], length 1448
14:08:43.546362 IP 172.16.22.141.34144 > 107.167.110.223.443: Flags [.], ack 1449, win 499, options [nop,nop,TS val 1558448621 ecr 2277206323,nop,nop,sack 1 {2897:3141}], length 0
14:08:43.551323 IP 172.16.19.98.53814 > 239.255.255.250.3702: UDP, length 656
14:08:43.565304 ARP, Request who-has 172.16.17.19 tell 172.16.16.60, length 46
14:08:43.565305 ARP, Request who-has 172.16.17.15 tell 172.16.16.60, length 46
14:08:43.570017 IP 142.250.193.101.443 > 172.16.22.141.59692: Flags [.], ack 2819, win 405, options [nop,nop,TS val 1053057170 ecr 3782086296,nop,nop,sack 1 {2780:2819}], length 0
14:08:43.602343 IP 107.167.110.224.443 > 172.16.22.141.58860: Flags [.], ack 598, win 83, options [nop,nop,TS val 1032916195 ecr 422834119], length 0
14:08:43.602566 IP 107.167.110.224.443 > 172.16.22.141.58860: Flags [.], ack 1105, win 83, options [nop,nop,TS val 1032916195 ecr 422834120], length 0
14:08:43.605204 IP 107.167.110.224.443 > 172.16.22.141.58860: Flags [P.], seq 3141:3419, ack 1105, win 83, options [nop,nop,TS val 1032916197 ecr 422834120], length 278
14:08:43.605228 IP 172.16.22.141.58860 > 107.167.110.224.443: Flags [.], ack 3419, win 501, options [nop,nop,TS val 422834395 ecr 1032916197], length 0
14:08:43.606462 IP 172.16.22.141.50558 > 107.167.110.216.443: Flags [F.], seq 0, ack 1, win 501, options [nop,nop,TS val 3849232891 ecr 2025763097], length 0
14:08:43.613210 IP 107.167.110.223.443 > 172.16.22.141.34146: Flags [S.], seq 652892807, ack 1883372281, win 43440, options [mss 1460,sackOK,TS val 2277206388 ecr 1558448422,nop,wscale 9], length 0
14:08:43.613275 IP 172.16.22.141.34146 > 107.167.110.223.443: Flags [.], ack 1, win 502, options [nop,nop,TS val 1558448688 ecr 2277206388], length 0
14:08:43.613754 IP 172.16.22.141.34146 > 107.167.110.223.443: Flags [P.], seq 1:518, ack 1, win 502, options [nop,nop,TS val 1558448689 ecr 2277206388], length 517
14:08:43.621119 IP 107.167.110.216.443 > 172.16.22.141.50558: Flags [R], seq 892866625, win 0, length 0
14:08:43.692929 IP 172.16.19.62.52473 > 239.255.255.250.1900: UDP, length 175
14:08:43.698340 IP 172.16.20.14.51354 > 255.255.255.255.3956: UDP, length 8
14:08:43.741099 ARP, Request who-has 172.16.18.206 tell 172.16.16.61, length 46
14:08:43.804027 IP6 fe80::50a3:a7be:c300:446c.53372 > ff02::c.1900: UDP, length 146
14:08:43.817618 IP 107.167.110.223.443 > 172.16.22.141.34144: Flags [.], seq 1449:2897, ack 518, win 84, options [nop,nop,TS val 2277206600 ecr 1558448621], length 1448
14:08:43.817668 IP 172.16.22.141.34144 > 107.167.110.223.443: Flags [.], ack 3141, win 499, options [nop,nop,TS val 1558448893 ecr 2277206600], length 0
14:08:43.818792 IP 172.16.22.141.34144 > 107.167.110.223.443: Flags [P.], seq 518:598, ack 3141, win 501, options [nop,nop,TS val 1558448894 ecr 2277206600], length 80
14:08:43.819099 IP 172.16.22.141.34144 > 107.167.110.223.443: Flags [P.], seq 598:1017, ack 3141, win 501, options [nop,nop,TS val 1558448894 ecr 2277206600], length 419
14:08:43.819154 IP 172.16.22.141.34144 > 107.167.110.223.443: Flags [P.], seq 1017:1100, ack 3141, win 501, options [nop,nop,TS val 1558448894 ecr 2277206600], length 83
14:08:43.872647 IP6 fe80::29a1:7e32:11bb:27a0.53815 > ff02::c.3702: UDP, length 656
14:08:43.876308 IP 107.167.110.223.443 > 172.16.22.141.34146: Flags [.], ack 518, win 83, options [nop,nop,TS val 2277206666 ecr 1558448689], length 0
14:08:43.877022 IP 107.167.110.223.443 > 172.16.22.141.34146: Flags [.], seq 1:1449, ack 518, win 83, options [nop,nop,TS val 2277206667 ecr 1558448689], length 1448
14:08:43.877044 IP 172.16.22.141.34146 > 107.167.110.223.443: Flags [.], ack 1449, win 501, options [nop,nop,TS val 1558448952 ecr 2277206667], length 0
14:08:43.877075 IP 107.167.110.223.443 > 172.16.22.141.34146: Flags [P.], seq 1449:2897, ack 518, win 83, options [nop,nop,TS val 2277206667 ecr 1558448689], length 1448
14:08:43.877082 IP 172.16.22.141.34146 > 107.167.110.223.443: Flags [.], ack 2897, win 495, options [nop,nop,TS val 1558448952 ecr 2277206667], length 0
14:08:43.877095 IP 107.167.110.223.443 > 172.16.22.141.34146: Flags [P.], seq 2897:3142, ack 518, win 83, options [nop,nop,TS val 2277206667 ecr 1558448689], length 245
14:08:43.877099 IP 172.16.22.141.34146 > 107.167.110.223.443: Flags [.], ack 3142, win 494, options [nop,nop,TS val 1558448952 ecr 2277206667], length 0
14:08:43.878331 IP 172.16.22.141.34146 > 107.167.110.223.443: Flags [P.], seq 518:598, ack 3142, win 501, options [nop,nop,TS val 1558448953 ecr 2277206667], length 80
14:08:43.894158 IP 172.16.21.179.53655 > 239.255.255.250.1900: UDP, length 175
14:08:43.919695 ARP, Request who-has 172.16.16.42 tell 172.16.22.173, length 46
14:08:43.946097 IP6 fe80::a3fe:9bf8:3f2:3909 > ff02::16: HBH ICMP6, multicast listener report v2, 2 group record(s), length 48
14:08:44.018527 IP 172.16.22.141.58862 > 107.167.110.224.443: Flags [S], seq 4105109912, win 64240, options [mss 1460,sackOK,TS val 422834809 ecr 0,nop,wscale 7], length 0
14:08:44.031538 IP 172.16.19.98.53814 > 239.255.255.250.3702: UDP, length 656
14:08:44.035234 ARP, Request who-has 172.16.23.204 tell 172.16.20.201, length 46
14:08:44.069742 IP 172.16.21.65.63138 > 239.255.255.250.1900: UDP, length 175
14:08:44.101886 IP 107.167.110.223.443 > 172.16.22.141.34144: Flags [.], ack 598, win 84, options [nop,nop,TS val 2277206880 ecr 1558448894], length 0
14:08:44.102963 IP 107.167.110.223.443 > 172.16.22.141.34144: Flags [.], ack 1017, win 84, options [nop,nop,TS val 2277206881 ecr 1558448894], length 0
14:08:44.102987 IP 107.167.110.223.443 > 172.16.22.141.34144: Flags [.], ack 1100, win 84, options [nop,nop,TS val 2277206881 ecr 1558448894], length 0
14:08:44.137025 IP 172.16.20.14.64002 > 255.255.255.255.3956: UDP, length 8
14:08:44.157755 IP 107.167.110.223.443 > 172.16.22.141.34146: Flags [.], ack 598, win 83, options [nop,nop,TS val 2277206942 ecr 1558448953], length 0
14:08:44.178560 IP 172.16.22.141.41960 > 185.26.182.112.443: Flags [.], ack 636207110, win 501, options [nop,nop,TS val 4208951043 ecr 3765983705], length 0
14:08:44.180653 ARP, Request who-has 172.16.18.209 tell 172.16.16.61, length 46
14:08:44.250572 ARP, Request who-has 172.16.18.208 tell 172.16.16.61, length 46
14:08:44.254366 IP6 fe80::a3fe:9bf8:3f2:3909 > ff02::16: HBH ICMP6, multicast listener report v2, 2 group record(s), length 48
14:08:44.304521 IP 107.167.110.224.443 > 172.16.22.141.58862: Flags [S.], seq 1319819594, ack 4105109913, win 43440, options [mss 1460,sackOK,TS val 1032916882 ecr 422834809,nop,wscale 9], length 0
14:08:44.304585 IP 172.16.22.141.58862 > 107.167.110.224.443: Flags [.], ack 1, win 502, options [nop,nop,TS val 422835095 ecr 1032916882], length 0
14:08:44.305088 IP 172.16.22.141.58862 > 107.167.110.224.443: Flags [P.], seq 1:518, ack 1, win 502, options [nop,nop,TS val 422835095 ecr 1032916882], length 517
14:08:44.307302 IP 172.16.20.14.64443 > 255.255.255.255.3956: UDP, length 8
14:08:44.348225 IP 185.26.182.112.443 > 172.16.22.141.41960: Flags [.], ack 1, win 83, options [nop,nop,TS val 3766030289 ecr 4208904416], length 0
14:08:44.379025 IP6 fe80::3eec:efff:fe7a:6812.546 > ff02::1:2.547: dhcp6 inf-req
14:08:44.400522 ARP, Request who-has 172.16.19.3 tell 0.0.0.0, length 46
14:08:44.429464 ARP, Request who-has 169.254.49.29 tell 0.0.0.0, length 46
14:08:44.455837 ARP, Request who-has 172.16.16.62 tell 172.16.16.41, length 46
14:08:44.468457 ARP, Request who-has 172.16.19.3 tell 172.16.16.62, length 46
14:08:44.468458 ARP, Request who-has 172.16.19.15 tell 172.16.16.62, length 46
14:08:44.468458 ARP, Request who-has 172.16.19.1 tell 172.16.16.62, length 46
14:08:44.468458 ARP, Request who-has 172.16.19.13 tell 172.16.16.62, length 46
14:08:44.468458 ARP, Request who-has 172.16.19.27 tell 172.16.16.62, length 46
14:08:44.468459 ARP, Request who-has 172.16.19.2 tell 172.16.16.62, length 46
14:08:44.468459 ARP, Request who-has 172.16.19.29 tell 172.16.16.62, length 46
14:08:44.468459 ARP, Request who-has 172.16.19.14 tell 172.16.16.62, length 46
14:08:44.468466 ARP, Request who-has 172.16.19.26 tell 172.16.16.62, length 46
14:08:44.468466 ARP, Request who-has 172.16.19.28 tell 172.16.16.62, length 46
14:08:44.468561 ARP, Request who-has 172.16.19.30 tell 172.16.16.62, length 46
14:08:44.468779 ARP, Request who-has 172.16.19.31 tell 172.16.16.62, length 46
14:08:44.521231 ARP, Request who-has 172.16.17.14 tell 172.16.17.14, length 46
14:08:44.565663 IP6 fe80::b03f:c897:6ca0:dcc5.5353 > ff02::fb.5353: 28780 PTR (QM)? _arduino._tcp.local. (37)
14:08:44.565665 ARP, Request who-has 172.16.17.15 tell 172.16.16.60, length 46
14:08:44.565697 ARP, Request who-has 172.16.17.19 tell 172.16.16.60, length 46
14:08:44.567614 ARP, Request who-has 172.16.19.42 tell 0.0.0.0, length 46
14:08:44.579492 IP 107.167.110.224.443 > 172.16.22.141.58862: Flags [.], ack 518, win 83, options [nop,nop,TS val 1032917171 ecr 422835095], length 0
14:08:44.579853 IP 107.167.110.224.443 > 172.16.22.141.58862: Flags [.], seq 1:1449, ack 518, win 83, options [nop,nop,TS val 1032917171 ecr 422835095], length 1448
14:08:44.579875 IP 172.16.22.141.58862 > 107.167.110.224.443: Flags [.], ack 1449, win 501, options [nop,nop,TS val 422835370 ecr 1032917171], length 0
14:08:44.579914 IP 107.167.110.224.443 > 172.16.22.141.58862: Flags [P.], seq 1449:2897, ack 518, win 83, options [nop,nop,TS val 1032917171 ecr 422835095], length 1448
14:08:44.579977 IP 172.16.22.141.58862 > 107.167.110.224.443: Flags [.], ack 2897, win 495, options [nop,nop,TS val 422835370 ecr 1032917171], length 0
14:08:44.579979 IP 107.167.110.224.443 > 172.16.22.141.58862: Flags [P.], seq 2897:3141, ack 518, win 83, options [nop,nop,TS val 1032917171 ecr 422835095], length 244
14:08:44.579982 IP 172.16.22.141.58862 > 107.167.110.224.443: Flags [.], ack 3141, win 494, options [nop,nop,TS val 422835370 ecr 1032917171], length 0
14:08:44.581270 IP 172.16.22.141.58862 > 107.167.110.224.443: Flags [P.], seq 518:598, ack 3141, win 501, options [nop,nop,TS val 422835371 ecr 1032917171], length 80
14:08:44.620126 IP 172.16.22.141.59692 > 142.250.193.101.443: Flags [.], seq 2819:4237, ack 12326, win 1341, options [nop,nop,TS val 3782087377 ecr 1053057170], length 1418
14:08:44.620135 IP 172.16.22.141.59692 > 142.250.193.101.443: Flags [P.], seq 4237:5247, ack 12326, win 1341, options [nop,nop,TS val 3782087377 ecr 1053057170], length 1010
14:08:44.644864 IP6 fe80::29a1:7e32:11bb:27a0.53815 > ff02::c.3702: UDP, length 656
14:08:44.651181 IP 142.250.193.101.443 > 172.16.22.141.59692: Flags [.], ack 4237, win 416, options [nop,nop,TS val 1053058251 ecr 3782087377], length 0
14:08:44.651212 IP 142.250.193.101.443 > 172.16.22.141.59692: Flags [.], ack 5247, win 427, options [nop,nop,TS val 1053058251 ecr 3782087377], length 0
14:08:44.661406 IP 172.16.16.43.33897 > 255.255.255.255.7437: UDP, length 173
14:08:44.689784 IP 172.16.20.99.60515 > 239.255.255.250.1900: UDP, length 101
14:08:44.741197 ARP, Request who-has 172.16.18.206 tell 172.16.16.61, length 46
14:08:44.749910 IP6 fe80::988:549e:97e4:bda2.53605 > ff02::c.3702: UDP, length 656
14:08:44.750096 IP 172.16.20.128.53604 > 239.255.255.250.3702: UDP, length 656
14:08:44.782392 IP6 fe80::3dd0:2628:8b28:d13a.546 > ff02::1:2.547: dhcp6 solicit
